,Unnamed: 0,Unnamed: 0.1,Unnamed: 0.1.1,screen_name,username,user_id,tweet_id,tweet_url,timestamp,timestamp_epochs,text,text_html,links,hashtags,has_media,img_urls,video_url,likes,retweets,replies,is_replied,is_reply_to,parent_tweet_id,reply_to_users,classofspeech,month
13,13,1448,1448,1957AJB,Andy Birss,296264280,1051014431616983040,/1957AJB/status/1051014431616983040,2018-10-13 07:39:02,1539416342,Heidi Allen voted in favour of cutting Universal Credit work allowance-Does nobody at #r4today ever bother to do any research at all before allowing an MP to spout her 'concern'? #r4today #800000gone,"<p class=""TweetTextSize js-tweet-text tweet-text"" data-aria-label-part=""0"" lang=""en""><strong>Heidi Allen</strong> voted in favour of cutting Universal Credit work allowance-Does nobody at <a class=""twitter-hashtag pretty-link js-nav"" data-query-source=""hashtag_click"" dir=""ltr"" href=""/hashtag/r4today?src=hash""><s>#</s><b>r4today</b></a> ever bother to do any research at all before allowing an MP to spout her 'concern'? <a class=""twitter-hashtag pretty-link js-nav"" data-query-source=""hashtag_click"" dir=""ltr"" href=""/hashtag/r4today?src=hash""><s>#</s><b>r4today</b></a> <a class=""twitter-hashtag pretty-link js-nav"" data-query-source=""hashtag_click"" dir=""ltr"" href=""/hashtag/800000gone?src=hash""><s>#</s><b>800000gone</b></a></p>",[],"['r4today', 'r4today', '800000gone']",False,[],,14,10,2,True,False,,[],offensive_language,10
18,18,4203,4203,WoodingdeanBLP,Woodingdean Labour Party,1012768646261854208,1099816722767532039,/WoodingdeanBLP/status/1099816722767532039,2019-02-24 23:41:54,1551051714,"Heidi Allen may base her politics on ""This is just what my party always does"", but Labour's manifesto is actually already built on evidence. Is she saying she hasn't looked at the evidence before voting in the past? That's enormously concerning! https://twitter.com/AyoCaesar/status/1099620987149172737 …","<p class=""TweetTextSize js-tweet-text tweet-text"" data-aria-label-part=""4"" lang=""en""><strong>Heidi Allen</strong> may base her politics on ""This is just what my party always does"", but Labour's manifesto is actually already built on evidence. Is she saying she hasn't looked at the evidence before voting in the past? That's enormously concerning! <a class=""twitter-timeline-link u-hidden"" data-expanded-url=""https://twitter.com/AyoCaesar/status/1099620987149172737"" dir=""ltr"" href=""https://t.co/vHp47x3ayT"" rel=""nofollow noopener"" target=""_blank"" title=""https://twitter.com/AyoCaesar/status/1099620987149172737""><span class=""tco-ellipsis""></span><span class=""invisible"">https://</span><span class=""js-display-url"">twitter.com/AyoCaesar/stat</span><span class=""invisible"">us/1099620987149172737</span><span class=""tco-ellipsis""><span class=""invisible""> </span>…</span></a></p>",['https://twitter.com/AyoCaesar/status/1099620987149172737'],[],False,[],,1,1,0,False,False,,[],offensive_language,2
72,72,2623,2623,S__A__M,SAM ✡️🇬🇧🏴󠁧󠁢󠁥󠁮󠁧󠁿,2687597780,1084003166914531328,/S__A__M/status/1084003166914531328,2019-01-12 08:24:29,1547281469,"If want 2 know y the government is in such a mess over the Brexit negotiations, look at the behaviour of the Tory MPs who pledged to respect the referendum & now undermine it. Like Heidi Allen MP, who does not even c herself as a Tory MP. Even though she nominally is one pic.twitter.com/gGOrJarumy","<p class=""TweetTextSize js-tweet-text tweet-text"" data-aria-label-part=""0"" lang=""en"">If want 2 know y the government is in such a mess over the Brexit negotiations, look at the behaviour of the Tory MPs who pledged to respect the referendum &amp; now undermine it. Like <strong>Heidi Allen</strong> MP, who does not even c herself as a Tory MP. Even though she nominally is one<img alt=""🤷🏻‍♂️"" aria-label=""Emoji: Man shrugging (light skin tone)"" class=""Emoji Emoji--forText"" draggable=""false"" src=""https://abs.twimg.com/emoji/v2/72x72/1f937-1f3fb-200d-2642-fe0f.png"" title=""Man shrugging (light skin tone)""/> <a class=""twitter-timeline-link u-hidden"" data-pre-embedded=""true"" dir=""ltr"" href=""https://t.co/gGOrJarumy"">pic.twitter.com/gGOrJarumy</a></p>",[],[],True,['https://pbs.twimg.com/media/DwsnITdWwAA46cY.jpg'],,45,27,6,True,False,,[],offensive_language,1
73,73,3538,3538,susannaeclark,Susanna Edith Clark,849267453620342784,1089090718864474117,/susannaeclark/status/1089090718864474117,2019-01-26 09:20:36,1548494436,I suspect that Heidi Allen is more interested in her image than those people who are truly suffering hardship - shame on her to use people in this way.  If she really cared she would desist from voting in cruel Tory policies  #IsupportLabour,"<p class=""TweetTextSize js-tweet-text tweet-text"" data-aria-label-part=""0"" lang=""en"">I suspect that <strong>Heidi Allen</strong> is more interested in her image than those people who are truly suffering hardship - shame on her to use people in this way.  If she really cared she would desist from voting in cruel Tory policies  <a class=""twitter-hashtag pretty-link js-nav"" data-query-source=""hashtag_click"" dir=""ltr"" href=""/hashtag/IsupportLabour?src=hash""><s>#</s><b>IsupportLabour</b></a></p>",[],['IsupportLabour'],False,[],,2,0,1,True,True,1.0889255157492122e+18,"[{'screen_name': 'SocialistVoice', 'user_id': '1833919200'}, {'screen_name': 'Shambles151', 'user_id': '54999242'}]",offensive_language,1
104,104,2044,2044,AdamGosling4,AdamGosling,1065333007949680645,1095953273247416320,/AdamGosling4/status/1095953273247416320,2019-02-14 07:49:56,1550130596,"If only Heidi Allen spoke up as much for oppressed taxpayers as she does for layabouts on benefits, she'd be a proper Tory MP. Why doesn't she just leave the party so that South Cambs can have a proper representative?","<p class=""TweetTextSize js-tweet-text tweet-text"" data-aria-label-part=""0"" lang=""en"">If only <strong>Heidi Allen</strong> spoke up as much for oppressed taxpayers as she does for layabouts on benefits, she'd be a proper Tory MP. Why doesn't she just leave the party so that South Cambs can have a proper representative?</p>",[],[],False,[],,0,0,0,False,True,1.0956811970558852e+18,"[{'screen_name': 'jrf_uk', 'user_id': '19834221'}, {'screen_name': 'heidiallen75', 'user_id': '426116125'}]",offensive_language,2
130,130,3574,3574,B9igndispo,Chris~Unite The People~Devismes #BDS,3123407097,1088918530190385157,/B9igndispo/status/1088918530190385157,2019-01-25 21:56:23,1548453383,"Or...
Frank Field does Wolf of Wall Street, starring Heidi Allen as the fall girl pouty symbolic heroine who's as transparent as a piece of Izal loo paper she's wiped her arse on.","<p class=""TweetTextSize js-tweet-text tweet-text"" data-aria-label-part=""0"" lang=""en"">Or...
Frank Field does Wolf of Wall Street, starring <strong>Heidi Allen</strong> as the fall girl pouty symbolic heroine who's as transparent as a piece of Izal loo paper she's wiped her arse on.</p>",[],[],False,[],,0,0,0,False,True,1.0887295401579396e+18,"[{'screen_name': 'docrussjackson', 'user_id': '2813049204'}]",offensive_language,1
135,135,3811,3811,KazzJenkins,Kazzia,257606752,1088626694544678913,/KazzJenkins/status/1088626694544678913,2019-01-25 02:36:44,1548383804,All you need to know about Heidi Allen. Will the real .@Heidiallen75 please stand up (and stop fucking crying over what you voted for)pic.twitter.com/xPU0h594uw,"<p class=""TweetTextSize js-tweet-text tweet-text"" data-aria-label-part=""0"" lang=""en"">All you need to know about <strong>Heidi Allen</strong>. Will the real .<a class=""twitter-atreply pretty-link js-nav"" data-mentioned-user-id=""426116125"" dir=""ltr"" href=""/heidiallen75""><s>@</s><b>Heidiallen75</b></a> please stand up (and stop fucking crying over what you voted for)<a class=""twitter-timeline-link u-hidden"" data-pre-embedded=""true"" dir=""ltr"" href=""https://t.co/xPU0h594uw"">pic.twitter.com/xPU0h594uw</a></p>",[],[],True,"['https://pbs.twimg.com/media/DxuULlPWwAES05f.jpg', 'https://pbs.twimg.com/media/DxuULlPWoAEEEv0.jpg', 'https://pbs.twimg.com/media/DxuULlOX0AAQxaj.jpg', 'https://pbs.twimg.com/media/DxuULlQXQAMkB6k.jpg']",,8,1,0,False,False,,[],offensive_language,1
164,164,755,755,S__A__M,SAM ✡️🇬🇧🏴󠁧󠁢󠁥󠁮󠁧󠁿,2687597780,1092852846851170306,/S__A__M/status/1092852846851170306,2019-02-05 18:29:57,1549391397,"I could never vote for Soubry. For the same reason I could not vote for Heidi Allen, or Phillip Lee. They have no integrity. They lied on the doorstep. There’s plenty of evidence to show it. If the current shit show can be pinned on anyone, it’s surely MPs like them.","<p class=""TweetTextSize js-tweet-text tweet-text"" data-aria-label-part=""0"" lang=""en"">I could never vote for Soubry. For the same reason I could not vote for <strong>Heidi Allen</strong>, or Phillip Lee. They have no integrity. They lied on the doorstep. There’s plenty of evidence to show it. If the current shit show can be pinned on anyone, it’s surely MPs like them.</p>",[],[],False,[],,46,16,1,True,True,1.0928519103344436e+18,"[{'screen_name': 'bernerlap', 'user_id': '289511094'}, {'screen_name': 'catwoman1966', 'user_id': '151920602'}]",offensive_language,2
171,171,620,620,Shadey1875,A painter's strife,729768458641084416,1056490439426142208,/Shadey1875/status/1056490439426142208,2018-10-28 10:18:44,1540721924,That’s really not the party you belong in if that’s what you want.,"<p class=""TweetTextSize js-tweet-text tweet-text"" data-aria-label-part=""0"" lang=""en"">That’s really not the party you belong in if that’s what you want.</p>",[],[],False,[],,2,0,0,False,True,1.0564669646994063e+18,"[{'screen_name': 'johnsmi10445214', 'user_id': '4692340285'}, {'screen_name': 'andreajenkyns', 'user_id': '1350441445'}]",offensive_language,10
175,175,1022,1022,iainduff9329,Iain Duff,897531147621736448,1072931908294795269,/iainduff9329/status/1072931908294795269,2018-12-12 19:11:15,1544641875,"Hopefully at least 21. Regardless, if she’s not ousted then the party will be finished for decades. I listened to Heidi Allen earlier, she’s voting for May but won’t support her deal. Incomprehensible, May won’t change her deal so why would you support her.","<p class=""TweetTextSize js-tweet-text tweet-text"" data-aria-label-part=""0"" lang=""en"">Hopefully at least 21. Regardless, if she’s not ousted then the party will be finished for decades. I listened to <strong>Heidi Allen</strong> earlier, she’s voting for May but won’t support her deal. Incomprehensible, May won’t change her deal so why would you support her.</p>",[],[],False,[],,1,0,0,False,True,1.0729149669221007e+18,"[{'screen_name': 'Lindajenking1', 'user_id': '1039409119285964800'}]",offensive_language,12
180,180,1228,1228,KevinPascoe,Kevin Pascoe #GetJohnsonOut,355187133,1063119021925720064,/KevinPascoe/status/1063119021925720064,2018-11-15 17:18:21,1542302301,Heidi Allen always says these things - then she votes with government https://twitter.com/itvpeston/status/1062850702106456064 …,"<p class=""TweetTextSize js-tweet-text tweet-text"" data-aria-label-part=""4"" lang=""en""><strong>Heidi Allen</strong> always says these things - then she votes with government <a class=""twitter-timeline-link u-hidden"" data-expanded-url=""https://twitter.com/itvpeston/status/1062850702106456064"" dir=""ltr"" href=""https://t.co/lMcEaQU3RF"" rel=""nofollow noopener"" target=""_blank"" title=""https://twitter.com/itvpeston/status/1062850702106456064""><span class=""tco-ellipsis""></span><span class=""invisible"">https://</span><span class=""js-display-url"">twitter.com/itvpeston/stat</span><span class=""invisible"">us/1062850702106456064</span><span class=""tco-ellipsis""><span class=""invisible""> </span>…</span></a></p>",['https://twitter.com/itvpeston/status/1062850702106456064'],[],False,[],,3,0,0,False,False,,[],offensive_language,11
215,215,1170,1170,absolute_INTJ,mona mishin 🤚🏽... #SaveOurNHSFromTories&LDs 💙,892966470,1064142397716799488,/absolute_INTJ/status/1064142397716799488,2018-11-18 13:04:53,1542546293,"Heidi Allen blocked me (perhaps for calling her a crybaby, drama-queen which she is) so don’t know what she has said, D. 
But She is a Tory as bad as the rest. Party first, people after. i don’t buy the face she puts when the cameras are on.","<p class=""TweetTextSize js-tweet-text tweet-text"" data-aria-label-part=""0"" lang=""en""><strong>Heidi Allen</strong> blocked me (perhaps for calling her a crybaby, drama-queen which she is) so don’t know what she has said, D. 
But She is a Tory as bad as the rest. Party first, people after. i don’t buy the face she puts when the cameras are on.</p>",[],[],False,[],,0,0,0,False,True,1.0635738718304748e+18,"[{'screen_name': 'duncanpoundcake', 'user_id': '995305016'}, {'screen_name': 'petergloss', 'user_id': '821798222045868032'}]",offensive_language,11
227,227,4271,4271,Daniel_Grigg,Daniel Grigg,44289341,1099688201831223297,/Daniel_Grigg/status/1099688201831223297,2019-02-24 15:11:13,1551021073,"Anna Soubry, Sarah Wollaston and Heidi Allen have to back Corbyn's amendment or vote against Theresa May in a no confidence vote. 

Only the Tory ""rebels"" have the numbers to stop her but they continue to let her ignore parliament. pic.twitter.com/IQOp6A1LvD","<p class=""TweetTextSize js-tweet-text tweet-text"" data-aria-label-part=""0"" lang=""en"">Anna Soubry, Sarah Wollaston and <strong>Heidi Allen</strong> have to back Corbyn's amendment or vote against Theresa May in a no confidence vote. 

Only the Tory ""rebels"" have the numbers to stop her but they continue to let her ignore parliament. <a class=""twitter-timeline-link u-hidden"" data-pre-embedded=""true"" dir=""ltr"" href=""https://t.co/IQOp6A1LvD"">pic.twitter.com/IQOp6A1LvD</a></p>",[],[],True,['https://pbs.twimg.com/media/D0LgX1wXcAIt8Yz.jpg'],,7,1,0,False,True,1.0996692616923505e+18,"[{'screen_name': 'ledredman', 'user_id': '105468938'}, {'screen_name': 'Keir_Starmer', 'user_id': '2425571623'}]",offensive_language,2
233,233,751,751,mickeyfinnlad,Mike #VoteLabour🌹,1387828454,1093059832423301120,/mickeyfinnlad/status/1093059832423301120,2019-02-06 08:12:26,1549440746,"I would point out the hypocrisy of Cryin’ Heidi Allen to her face, but she blocked me.

She sobbed at the sight of starving people and said she hated austerity. Yesterday, she voted to strip more money away from councils and deepen austerity further.

Never trust a Tory. pic.twitter.com/37NoKpMaRX","<p class=""TweetTextSize js-tweet-text tweet-text"" data-aria-label-part=""0"" lang=""en"">I would point out the hypocrisy of Cryin’ <strong>Heidi Allen</strong> to her face, but she blocked me.

She sobbed at the sight of starving people and said she hated austerity. Yesterday, she voted to strip more money away from councils and deepen austerity further.

Never trust a Tory. <a class=""twitter-timeline-link u-hidden"" data-pre-embedded=""true"" dir=""ltr"" href=""https://t.co/37NoKpMaRX"">pic.twitter.com/37NoKpMaRX</a></p>",[],[],True,['https://pbs.twimg.com/media/DytUGIhX4AAT11K.jpg'],,0,1,0,False,False,,[],offensive_language,2
290,290,1444,1444,Christi80172188,Chrissie,745001684179501061,1051044070750126080,/Christi80172188/status/1051044070750126080,2018-10-13 09:36:48,1539423408,#r4today First they divided working/nonworking Then  they went 4 the disabled Now they  cream Off our taxes into tax havens thru outsourcing n try to woo the young by attacking the old Fuck Off Heidi Allen n  Resolution Foundation Bloody joke,"<p class=""TweetTextSize js-tweet-text tweet-text"" data-aria-label-part=""0"" lang=""en""><a class=""twitter-hashtag pretty-link js-nav"" data-query-source=""hashtag_click"" dir=""ltr"" href=""/hashtag/r4today?src=hash""><s>#</s><b>r4today</b></a> First they divided working/nonworking Then  they went 4 the disabled Now they  cream Off our taxes into tax havens thru outsourcing n try to woo the young by attacking the old Fuck Off <strong>Heidi Allen</strong> n  Resolution Foundation <img alt=""😂"" aria-label=""Emoji: Face with tears of joy"" class=""Emoji Emoji--forText"" draggable=""false"" src=""https://abs.twimg.com/emoji/v2/72x72/1f602.png"" title=""Face with tears of joy""/>Bloody joke</p>",[],['r4today'],False,[],,2,1,0,False,False,,[],offensive_language,10
301,301,2605,2605,MsFinalSay,MsFinalSay 🇪🇺FINALSAYBITCH,614512417,1084077084107001857,/MsFinalSay/status/1084077084107001857,2019-01-12 13:18:12,1547299092,"I’m sure Heidi Allen means well, but her voting records suggests she really needs to try harder. It’s no good going around trying to undo the appalling deliberate cruelty of her party, after supporting it.","<p class=""TweetTextSize js-tweet-text tweet-text"" data-aria-label-part=""0"" lang=""en"">I’m sure <strong>Heidi Allen</strong> means well, but her voting records suggests she really needs to try harder. It’s no good going around trying to undo the appalling deliberate cruelty of her party, after supporting it.</p>",[],[],False,[],,1,0,1,True,True,1.0838281314531738e+18,"[{'screen_name': 'heeno57', 'user_id': '1073292099087462400'}, {'screen_name': 'CorbynistaTeen', 'user_id': '937330903717765120'}]",offensive_language,1
307,307,2451,2451,OldCrom,oldcrom,71799264,1085146851496603649,/OldCrom/status/1085146851496603649,2019-01-15 12:09:05,1547554145,"Thanks for that SAM, I have read the statement and believe that Heidi Allen speaks from her heart and is genuine, you are lucky to have her as your MP, although she clearly does not have your support but you cannot please all the people all the time https://twitter.com/S__A__M/status/1085137379315384320 …","<p class=""TweetTextSize js-tweet-text tweet-text"" data-aria-label-part=""4"" lang=""en"">Thanks for that SAM, I have read the statement and believe that <strong>Heidi Allen</strong> speaks from her heart and is genuine, you are lucky to have her as your MP, although she clearly does not have your support but you cannot please all the people all the time<img alt=""👏"" aria-label=""Emoji: Clapping hands sign"" class=""Emoji Emoji--forText"" draggable=""false"" src=""https://abs.twimg.com/emoji/v2/72x72/1f44f.png"" title=""Clapping hands sign""/> <a class=""twitter-timeline-link u-hidden"" data-expanded-url=""https://twitter.com/S__A__M/status/1085137379315384320"" dir=""ltr"" href=""https://t.co/Vkv5oJf1Yo"" rel=""nofollow noopener"" target=""_blank"" title=""https://twitter.com/S__A__M/status/1085137379315384320""><span class=""tco-ellipsis""></span><span class=""invisible"">https://</span><span class=""js-display-url"">twitter.com/S__A__M/status</span><span class=""invisible"">/1085137379315384320</span><span class=""tco-ellipsis""><span class=""invisible""> </span>…</span></a></p>",['https://twitter.com/S__A__M/status/1085137379315384320'],[],False,[],,0,0,0,False,False,,[],offensive_language,1
312,312,220,220,tongs_ya_bass,Tongs,2730055159,1058792973918441472,/tongs_ya_bass/status/1058792973918441472,2018-11-03 18:48:11,1541270891,My vote would go to Heidi Allen. Seems a genuinely caring person compared to her #Tory colleagues...and is on record as saying she would rather be sitting as an independent MP as she doesn't fully agree with Tory policies!pic.twitter.com/hlwlmP7wwI,"<p class=""TweetTextSize js-tweet-text tweet-text"" data-aria-label-part=""0"" lang=""en"">My vote would go to <strong>Heidi Allen</strong>. Seems a genuinely caring person compared to her <a class=""twitter-hashtag pretty-link js-nav"" data-query-source=""hashtag_click"" dir=""ltr"" href=""/hashtag/Tory?src=hash""><s>#</s><b>Tory</b></a> colleagues...and is on record as saying she would rather be sitting as an independent MP as she doesn't fully agree with Tory policies!<a class=""twitter-timeline-link u-hidden"" data-pre-embedded=""true"" dir=""ltr"" href=""https://t.co/hlwlmP7wwI"">pic.twitter.com/hlwlmP7wwI</a></p>",[],['Tory'],True,['https://pbs.twimg.com/media/DrGWleMW4AAM5TP.jpg'],,1,0,1,True,True,1.0587396436450714e+18,"[{'screen_name': 'Jefforbited', 'user_id': '227937965'}]",offensive_language,11
324,324,3499,3499,suegray834,Sue Gray 1 💚🌹💚 NHS ❤️ ✊🏻 🌹VOTE LABOUR🌹👍🏻🗳,3293897116,1089191991840264192,/suegray834/status/1089191991840264192,2019-01-26 16:03:01,1548518581,Totally agree! Heidi Allen been crying about the poor for too long! No one believes her!look at her voting History she voted for all the cuts that have caused more FOODBANKS to open!,"<p class=""TweetTextSize js-tweet-text tweet-text"" data-aria-label-part=""0"" lang=""en"">Totally agree! <strong>Heidi Allen</strong> been crying about the poor for too long! No one believes her!look at her voting History she voted for all the cuts that have caused more FOODBANKS to open!</p>",[],[],False,[],,6,2,0,False,True,1.089111339870634e+18,"[{'screen_name': 'steve_avison', 'user_id': '3427661555'}, {'screen_name': 'heidiallen75', 'user_id': '426116125'}]",offensive_language,1
326,326,2179,2179,mickeyfinnlad,Mike #VoteLabour🌹,1387828454,1087648702070706177,/mickeyfinnlad/status/1087648702070706177,2019-01-22 09:50:32,1548150632,I wish I could see this but Heidi Allen blocked me after I called her bluff post crying at starving people. https://twitter.com/helenmallam/status/1087316742630723584 …,"<p class=""TweetTextSize js-tweet-text tweet-text"" data-aria-label-part=""4"" lang=""en"">I wish I could see this but <strong>Heidi Allen</strong> blocked me after I called her bluff post crying at starving people. <a class=""twitter-timeline-link u-hidden"" data-expanded-url=""https://twitter.com/helenmallam/status/1087316742630723584"" dir=""ltr"" href=""https://t.co/GpqLxIUBQQ"" rel=""nofollow noopener"" target=""_blank"" title=""https://twitter.com/helenmallam/status/1087316742630723584""><span class=""tco-ellipsis""></span><span class=""invisible"">https://</span><span class=""js-display-url"">twitter.com/helenmallam/st</span><span class=""invisible"">atus/1087316742630723584</span><span class=""tco-ellipsis""><span class=""invisible""> </span>…</span></a></p>",['https://twitter.com/helenmallam/status/1087316742630723584'],[],False,[],,0,0,1,True,False,,[],offensive_language,1
333,333,511,511,ErdmuteD,Erdmute Wendlinger D,497126517,1065300570767073280,/ErdmuteD/status/1065300570767073280,2018-11-21 17:47:03,1542822423,Heidi Allen and   Dr Sarah are about the only normal Tory woman I feel I could relate to at all.They're a dreadful including Liz Truss who sounds when she speaks. as though she's operated by Batteries. She just spouts all the phrases that CCHQ have told her to include.,"<p class=""TweetTextSize js-tweet-text tweet-text"" data-aria-label-part=""0"" lang=""en""><strong>Heidi Allen</strong> and   Dr Sarah are about the only normal Tory woman I feel I could relate to at all.They're a dreadful including Liz Truss who sounds when she speaks. as though she's operated by Batteries. She just spouts all the phrases that CCHQ have told her to include.</p>",[],[],False,[],,4,0,0,False,True,1.0652056995406438e+18,"[{'screen_name': 'sonic_fred', 'user_id': '1041997304910303232'}]",offensive_language,11
358,358,2743,2743,MarthedeFerrer,Marthe de Ferrer,126091340,1082989566959722496,/MarthedeFerrer/status/1082989566959722496,2019-01-09 13:16:48,1547039808,"Heidi Allen continues to be one of my favourite politicians. Proud former constituent of hers.*

(((*albeit not a constituent who ever voted for her because while I like her, I don’t and won’t vote Tory...))) https://twitter.com/HannahAlOthman/status/1082987866047815685 …","<p class=""TweetTextSize js-tweet-text tweet-text"" data-aria-label-part=""4"" lang=""en""><strong>Heidi Allen</strong> continues to be one of my favourite politicians. Proud former constituent of hers.*

(((*albeit not a constituent who ever voted for her because while I like her, I don’t and won’t vote Tory...))) <a class=""twitter-timeline-link u-hidden"" data-expanded-url=""https://twitter.com/HannahAlOthman/status/1082987866047815685"" dir=""ltr"" href=""https://t.co/Nrh8nvMKoF"" rel=""nofollow noopener"" target=""_blank"" title=""https://twitter.com/HannahAlOthman/status/1082987866047815685""><span class=""tco-ellipsis""></span><span class=""invisible"">https://</span><span class=""js-display-url"">twitter.com/HannahAlOthman</span><span class=""invisible"">/status/1082987866047815685</span><span class=""tco-ellipsis""><span class=""invisible""> </span>…</span></a></p>",['https://twitter.com/HannahAlOthman/status/1082987866047815685'],[],False,[],,9,3,2,True,False,,[],offensive_language,1
367,367,1438,1438,Dorset_Owl,Dorset Owl,908320108631781378,1051113644057128960,/Dorset_Owl/status/1051113644057128960,2018-10-13 14:13:16,1539439996,How many times is Heidi Allen going to try to put the brakes on what her party is doing before she realises that it's not a very nice party? https://twitter.com/BBCPolitics/status/1051112520260423680 …,"<p class=""TweetTextSize js-tweet-text tweet-text"" data-aria-label-part=""4"" lang=""en"">How many times is <strong>Heidi Allen</strong> going to try to put the brakes on what her party is doing before she realises that it's not a very nice party? <a class=""twitter-timeline-link u-hidden"" data-expanded-url=""https://twitter.com/BBCPolitics/status/1051112520260423680"" dir=""ltr"" href=""https://t.co/o7WItk0tJA"" rel=""nofollow noopener"" target=""_blank"" title=""https://twitter.com/BBCPolitics/status/1051112520260423680""><span class=""tco-ellipsis""></span><span class=""invisible"">https://</span><span class=""js-display-url"">twitter.com/BBCPolitics/st</span><span class=""invisible"">atus/1051112520260423680</span><span class=""tco-ellipsis""><span class=""invisible""> </span>…</span></a></p>",['https://twitter.com/BBCPolitics/status/1051112520260423680'],[],False,[],,1,0,0,False,False,,[],offensive_language,10
