,Unnamed: 0,Unnamed: 0.1,Unnamed: 0.1.1,screen_name,username,user_id,tweet_id,tweet_url,timestamp,timestamp_epochs,text,text_html,links,hashtags,has_media,img_urls,video_url,likes,retweets,replies,is_replied,is_reply_to,parent_tweet_id,reply_to_users,classofspeech,month
960,960,2606,2606,MsFinalSay,MsFinalSay 🇪🇺FINALSAYBITCH,614512417,1084075645817237504,/MsFinalSay/status/1084075645817237504,2019-01-12 13:12:29,1547298749,"I really want to believe #HeidiAllen means well, but her voting record is a disappointment to me, most of the time. It’s party before country, every time. She really needs to try harder.","<p class=""TweetTextSize js-tweet-text tweet-text"" data-aria-label-part=""0"" lang=""en"">I really want to believe <a class=""twitter-hashtag pretty-link js-nav"" data-query-source=""hashtag_click"" dir=""ltr"" href=""/hashtag/HeidiAllen?src=hash""><s>#</s><b><strong>HeidiAllen</strong></b></a> means well, but her voting record is a disappointment to me, most of the time. It’s party before country, every time. She really needs to try harder.</p>",[],['HeidiAllen'],False,[],,2,2,0,False,True,1.0840188464308428e+18,"[{'screen_name': 'Michelle4Labour', 'user_id': '942739263577260033'}, {'screen_name': 'mendaleak1', 'user_id': '2591059722'}]",offensive_language,1
963,963,442,442,MatthewBarton,Matthew Barton,27699168,1067008605323444224,/MatthewBarton/status/1067008605323444224,2018-11-26 10:54:10,1543229650,"I would, but the delightful Heidi Allen blocked me when I called her out on the school dinner scandal. Don't believe I'm her only constituent in that position. Feel free to get on her case for us though!","<p class=""TweetTextSize js-tweet-text tweet-text"" data-aria-label-part=""0"" lang=""en"">I would, but the delightful <strong>Heidi Allen</strong> blocked me when I called her out on the school dinner scandal. Don't believe I'm her only constituent in that position. Feel free to get on her case for us though!</p>",[],[],False,[],,4,1,0,False,True,1.0670072991207136e+18,"[{'screen_name': 'OwenJones84', 'user_id': '65045121'}]",offensive_language,11
985,985,1832,1832,John50865218,John #DrainTheSwamp #MBGA #LeaveMeansLeave,978229170898636800,1052115283698167808,/John50865218/status/1052115283698167808,2018-10-16 08:33:25,1539678805,"Shame on Heidi Allen - let's hope all the illegal immigrants swarm to her constituency. What about when one of her PROPER BRITISH constituents is raped, mugged, stabbed or killed - bet she says 'Nothing to do with me - and blame a white person instead'  https://twitter.com/WestmonsterUK/status/1051817678875316224 …","<p class=""TweetTextSize js-tweet-text tweet-text"" data-aria-label-part=""4"" lang=""en"">Shame on <strong>Heidi Allen</strong> - let's hope all the illegal immigrants swarm to her constituency. What about when one of her PROPER BRITISH constituents is raped, mugged, stabbed or killed - bet she says 'Nothing to do with me - and blame a white person instead' <img alt=""🇬🇧"" aria-label=""Emoji: Flag of United Kingdom"" class=""Emoji Emoji--forText"" draggable=""false"" src=""https://abs.twimg.com/emoji/v2/72x72/1f1ec-1f1e7.png"" title=""Flag of United Kingdom""/><img alt=""🇬🇧"" aria-label=""Emoji: Flag of United Kingdom"" class=""Emoji Emoji--forText"" draggable=""false"" src=""https://abs.twimg.com/emoji/v2/72x72/1f1ec-1f1e7.png"" title=""Flag of United Kingdom""/><img alt=""🇬🇧"" aria-label=""Emoji: Flag of United Kingdom"" class=""Emoji Emoji--forText"" draggable=""false"" src=""https://abs.twimg.com/emoji/v2/72x72/1f1ec-1f1e7.png"" title=""Flag of United Kingdom""/> <a class=""twitter-timeline-link u-hidden"" data-expanded-url=""https://twitter.com/WestmonsterUK/status/1051817678875316224"" dir=""ltr"" href=""https://t.co/0NCzU1tRNU"" rel=""nofollow noopener"" target=""_blank"" title=""https://twitter.com/WestmonsterUK/status/1051817678875316224""><span class=""tco-ellipsis""></span><span class=""invisible"">https://</span><span class=""js-display-url"">twitter.com/WestmonsterUK/</span><span class=""invisible"">status/1051817678875316224</span><span class=""tco-ellipsis""><span class=""invisible""> </span>…</span></a></p>",['https://twitter.com/WestmonsterUK/status/1051817678875316224'],[],False,[],,0,0,0,False,False,,[],offensive_language,10
1006,1006,932,932,Heatherhornett,Heather Macbeth,95397516,1074796141408108544,/Heatherhornett/status/1074796141408108544,2018-12-17 22:39:03,1545086343,"I wrote to my South Cambs MP Heidi Allen about Brexit, global warming, UK being a shrinking island facing rising sea levels Fenland Cambs.  Got standard reply saying there's a link to her web page, she doesn't reply to emails about Brexit as she gets so many!","<p class=""TweetTextSize js-tweet-text tweet-text"" data-aria-label-part=""0"" lang=""en"">I wrote to my South Cambs MP <strong>Heidi Allen</strong> about Brexit, global warming, UK being a shrinking island facing rising sea levels Fenland Cambs.  Got standard reply saying there's a link to her web page, she doesn't reply to emails about Brexit as she gets so many!</p>",[],[],False,[],,0,0,0,False,True,1.0747822105432433e+18,"[{'screen_name': 'CarolineLucas', 'user_id': '80802900'}]",offensive_language,12
1010,1010,2191,2191,pgw_26,de Willems,722581892,1087436701469954049,/pgw_26/status/1087436701469954049,2019-01-21 19:48:07,1548100087,"But if you deselect her as your official candidate, your choice will be swamped by moderate voters like me as we'll force Heidi Allen to stand as an independent and she will win","<p class=""TweetTextSize js-tweet-text tweet-text"" data-aria-label-part=""0"" lang=""en"">But if you deselect her as your official candidate, your choice will be swamped by moderate voters like me as we'll force <strong>Heidi Allen</strong> to stand as an independent and she will win</p>",[],[],False,[],,1,0,0,False,True,1.0870597333018624e+18,"[{'screen_name': 'heidiallen75', 'user_id': '426116125'}, {'screen_name': 'loishyett', 'user_id': '252086549'}]",offensive_language,1
1017,1017,3562,3562,Lady_Colleen,Colleen Hawkins #VoteLabour 🌹,469894215,1088943651823210501,/Lady_Colleen/status/1088943651823210501,2019-01-25 23:36:12,1548459372,"Yep. Cry-di Allen can shove her self-serving boo-hooing up her arse.

Don't cry for us, Heidi Allen
The truth is, you voted for this
For all the cruelty, a sad substitence
Too late to promise
Just keep your distance!

@heidiallen75
#ToryCutsKill #ScrapUniversalCredithttps://twitter.com/ArgyleLoz/status/1088766542408572928 …","<p class=""TweetTextSize js-tweet-text tweet-text"" data-aria-label-part=""4"" lang=""en"">Yep. Cry-di Allen can shove her self-serving boo-hooing up her arse.

Don't cry for us, <strong>Heidi Allen</strong>
The truth is, you voted for this
For all the cruelty, a sad substitence
Too late to promise
Just keep your distance!

<a class=""twitter-atreply pretty-link js-nav"" data-mentioned-user-id=""426116125"" dir=""ltr"" href=""/heidiallen75""><s>@</s><b>heidiallen75</b></a>
<a class=""twitter-hashtag pretty-link js-nav"" data-query-source=""hashtag_click"" dir=""ltr"" href=""/hashtag/ToryCutsKill?src=hash""><s>#</s><b>ToryCutsKill</b></a> <a class=""twitter-hashtag pretty-link js-nav"" data-query-source=""hashtag_click"" dir=""ltr"" href=""/hashtag/ScrapUniversalCredit?src=hash""><s>#</s><b>ScrapUniversalCredit</b></a><a class=""twitter-timeline-link u-hidden"" data-expanded-url=""https://twitter.com/ArgyleLoz/status/1088766542408572928"" dir=""ltr"" href=""https://t.co/mqoknN12Lk"" rel=""nofollow noopener"" target=""_blank"" title=""https://twitter.com/ArgyleLoz/status/1088766542408572928""><span class=""tco-ellipsis""></span><span class=""invisible"">https://</span><span class=""js-display-url"">twitter.com/ArgyleLoz/stat</span><span class=""invisible"">us/1088766542408572928</span><span class=""tco-ellipsis""><span class=""invisible""> </span>…</span></a></p>",['https://twitter.com/ArgyleLoz/status/1088766542408572928'],"['ToryCutsKill', 'ScrapUniversalCredithttps']",False,[],,0,0,0,False,False,,[],offensive_language,1
1042,1042,3816,3816,squeezyjohn,John Spiers Esq. #GTTO,95442746,1088603630914232321,/squeezyjohn/status/1088603630914232321,2019-01-25 01:05:05,1548378305,Oh for fuck's sake ... how stupid do the Tories think we are?  Austerity is theirs ... it's what they do ... Tory MP Heidi Allen gets crocodile tears about the effects of austerity she has continually voted for and we're supposed to nod and vote for her? https://www.theguardian.com/society/2019/jan/24/ive-absolutely-had-enough-tory-mp-embarks-on-anti-austerity-tour?CMP=share_btn_tw …,"<p class=""TweetTextSize js-tweet-text tweet-text"" data-aria-label-part=""0"" lang=""en"">Oh for fuck's sake ... how stupid do the Tories think we are?  Austerity is theirs ... it's what they do ... Tory MP <strong>Heidi Allen</strong> gets crocodile tears about the effects of austerity she has continually voted for and we're supposed to nod and vote for her? <a class=""twitter-timeline-link"" data-expanded-url=""https://www.theguardian.com/society/2019/jan/24/ive-absolutely-had-enough-tory-mp-embarks-on-anti-austerity-tour?CMP=share_btn_tw"" dir=""ltr"" href=""https://t.co/9FUZhVbb8o"" rel=""nofollow noopener"" target=""_blank"" title=""https://www.theguardian.com/society/2019/jan/24/ive-absolutely-had-enough-tory-mp-embarks-on-anti-austerity-tour?CMP=share_btn_tw""><span class=""tco-ellipsis""></span><span class=""invisible"">https://www.</span><span class=""js-display-url"">theguardian.com/society/2019/j</span><span class=""invisible"">an/24/ive-absolutely-had-enough-tory-mp-embarks-on-anti-austerity-tour?CMP=share_btn_tw</span><span class=""tco-ellipsis""><span class=""invisible""> </span>…</span></a></p>",['https://www.theguardian.com/society/2019/jan/24/ive-absolutely-had-enough-tory-mp-embarks-on-anti-austerity-tour?CMP=share_btn_tw'],[],False,[],,40,13,6,True,False,,[],offensive_language,1
1043,1043,3503,3503,kimwalsh22,kimberly ♌️🌞♍️🌙♑️💫 #JC4PM2019 🌹,538511018,1089182469453168641,/kimwalsh22/status/1089182469453168641,2019-01-26 15:25:11,1548516311,"If you happen to meet Heidi Allen, Conservative MP doing her anti austerity (I smell bullshit) campaign. Please remember to ask her why she voted in line to make the poor worse off instead, cut benefits and other questions instead of smiling for a photo op.","<p class=""TweetTextSize js-tweet-text tweet-text"" data-aria-label-part=""0"" lang=""en"">If you happen to meet <strong>Heidi Allen</strong>, Conservative MP doing her anti austerity (I smell bullshit) campaign. Please remember to ask her why she voted in line to make the poor worse off instead, cut benefits and other questions instead of smiling for a photo op.</p>",[],[],False,[],,1,0,0,False,False,,[],offensive_language,1
1055,1055,654,654,NormanKenneth3,All Seeing Eye,1039921132546211842,1055770282663858177,/NormanKenneth3/status/1055770282663858177,2018-10-26 10:37:05,1540550225,"#victorialive  rather than damaging her own reputation by defending the government, tory mp,heidi allen should become an independent mp.
i'm sure that if she is a good mp, she will be voted in at the next election, so her voice can still be heard","<p class=""TweetTextSize js-tweet-text tweet-text"" data-aria-label-part=""0"" lang=""en""><a class=""twitter-hashtag pretty-link js-nav"" data-query-source=""hashtag_click"" dir=""ltr"" href=""/hashtag/victorialive?src=hash""><s>#</s><b>victorialive</b></a>  rather than damaging her own reputation by defending the government, tory mp,<strong>heidi allen</strong> should become an independent mp.
i'm sure that if she is a good mp, she will be voted in at the next election, so her voice can still be heard</p>",[],['victorialive'],False,[],,0,0,0,False,False,,[],offensive_language,10
1062,1062,3495,3495,NickJanczak,Nick Janczak,3327619575,1089204844836073479,/NickJanczak/status/1089204844836073479,2019-01-26 16:54:06,1548521646,Here's Heidi Allen's voting record before she goes on tour to do her whitewashing of the damage done to the poor by Tory fake-austerity measures. https://twitter.com/alberttrigg/status/1088554885598101509 …,"<p class=""TweetTextSize js-tweet-text tweet-text"" data-aria-label-part=""4"" lang=""en"">Here's <strong>Heidi Allen</strong>'s voting record before she goes on tour to do her whitewashing of the damage done to the poor by Tory fake-austerity measures. <a class=""twitter-timeline-link u-hidden"" data-expanded-url=""https://twitter.com/alberttrigg/status/1088554885598101509"" dir=""ltr"" href=""https://t.co/gvRcxY0S8g"" rel=""nofollow noopener"" target=""_blank"" title=""https://twitter.com/alberttrigg/status/1088554885598101509""><span class=""tco-ellipsis""></span><span class=""invisible"">https://</span><span class=""js-display-url"">twitter.com/alberttrigg/st</span><span class=""invisible"">atus/1088554885598101509</span><span class=""tco-ellipsis""><span class=""invisible""> </span>…</span></a></p>",['https://twitter.com/alberttrigg/status/1088554885598101509'],[],False,[],,10,9,1,True,False,,[],offensive_language,1
1068,1068,3606,3606,gallantfive,Charles Ingram #FBPE 🏴󠁧󠁢󠁥󠁮󠁧󠁿🇮🇪🇪🇺,1889683170,1088864212154286082,/gallantfive/status/1088864212154286082,2019-01-25 18:20:32,1548440432,"I do. What a terrible hypocrite #HeidiAllen is. She’s done serious damage and now she must be booted out of our Parliament like so many other MPs. Her voting record is a disgrace to humanity, not to mention UK.","<p class=""TweetTextSize js-tweet-text tweet-text"" data-aria-label-part=""0"" lang=""en"">I do. What a terrible hypocrite <a class=""twitter-hashtag pretty-link js-nav"" data-query-source=""hashtag_click"" dir=""ltr"" href=""/hashtag/HeidiAllen?src=hash""><s>#</s><b><strong>HeidiAllen</strong></b></a> is. She’s done serious damage and now she must be booted out of our Parliament like so many other MPs. Her voting record is a disgrace to humanity, not to mention UK.</p>",[],['HeidiAllen'],False,[],,1,0,0,False,True,1.08852433966071e+18,"[{'screen_name': 'DrFrancesRyan', 'user_id': '294668347'}]",offensive_language,1
1083,1083,2182,2182,shahil95,Shahil Parmar,507410602,1087619115873980417,/shahil95/status/1087619115873980417,2019-01-22 07:52:58,1548143578,"Tory MP Heidi Allen is complicit because a little less than a week ago she voted against the motion of no confidence in Theresa May. 

Don’t be fooled by her.

#r4today #PoliticsLivehttps://twitter.com/heidiallen75/status/1087278900173029376 …","<p class=""TweetTextSize js-tweet-text tweet-text"" data-aria-label-part=""4"" lang=""en"">Tory MP <strong>Heidi Allen</strong> is complicit because a little less than a week ago she voted against the motion of no confidence in Theresa May. 

Don’t be fooled by her.

<a class=""twitter-hashtag pretty-link js-nav"" data-query-source=""hashtag_click"" dir=""ltr"" href=""/hashtag/r4today?src=hash""><s>#</s><b>r4today</b></a> <a class=""twitter-hashtag pretty-link js-nav"" data-query-source=""hashtag_click"" dir=""ltr"" href=""/hashtag/PoliticsLive?src=hash""><s>#</s><b>PoliticsLive</b></a><a class=""twitter-timeline-link u-hidden"" data-expanded-url=""https://twitter.com/heidiallen75/status/1087278900173029376"" dir=""ltr"" href=""https://t.co/3yZdaVEFfr"" rel=""nofollow noopener"" target=""_blank"" title=""https://twitter.com/heidiallen75/status/1087278900173029376""><span class=""tco-ellipsis""></span><span class=""invisible"">https://</span><span class=""js-display-url"">twitter.com/heidiallen75/s</span><span class=""invisible"">tatus/1087278900173029376</span><span class=""tco-ellipsis""><span class=""invisible""> </span>…</span></a></p>",['https://twitter.com/heidiallen75/status/1087278900173029376'],"['r4today', 'PoliticsLivehttps']",False,[],,0,0,0,False,False,,[],offensive_language,1
1084,1084,1064,1064,jeffgaines287,Jeff Gaines,3855039328,1072819321963986945,/jeffgaines287/status/1072819321963986945,2018-12-12 11:43:53,1544615033,Heidi Allen has just said she will back May but not her deal! Useless.,"<p class=""TweetTextSize js-tweet-text tweet-text"" data-aria-label-part=""0"" lang=""en""><strong>Heidi Allen</strong> has just said she will back May but not her deal! Useless.</p>",[],[],False,[],,2,0,0,False,True,1.0727987843447684e+18,"[{'screen_name': 'Michael_Heaver', 'user_id': '22800916'}, {'screen_name': 'BrexitBattalion', 'user_id': '1040973693822881792'}]",offensive_language,12
1091,1091,2666,2666,TheGreatLummox,Jed Williamson,2652738381,1083710318134599681,/TheGreatLummox/status/1083710318134599681,2019-01-11 13:00:48,1547211648,Does Heidi Allen know how to tilt her screen? #PoliticsLive,"<p class=""TweetTextSize js-tweet-text tweet-text"" data-aria-label-part=""0"" lang=""en"">Does <strong>Heidi Allen</strong> know how to tilt her screen? <a class=""twitter-hashtag pretty-link js-nav"" data-query-source=""hashtag_click"" dir=""ltr"" href=""/hashtag/PoliticsLive?src=hash""><s>#</s><b>PoliticsLive</b></a></p>",[],['PoliticsLive'],False,[],,0,0,0,False,False,,[],offensive_language,1
1115,1115,2496,2496,dowley_ann,Sally-Ann Dowley,731615315168243712,1084581344641015809,/dowley_ann/status/1084581344641015809,2019-01-13 22:41:57,1547419317,"What utter codswallop from the self-important, self-serving Heidi Allen.  She should be deselected for failing her Constituents! https://twitter.com/NadineDorries/status/1084540291372273664 …","<p class=""TweetTextSize js-tweet-text tweet-text"" data-aria-label-part=""4"" lang=""en"">What utter codswallop from the self-important, self-serving <strong>Heidi Allen</strong>.  She should be deselected for failing her Constituents! <a class=""twitter-timeline-link u-hidden"" data-expanded-url=""https://twitter.com/NadineDorries/status/1084540291372273664"" dir=""ltr"" href=""https://t.co/HOuNKm7ZBG"" rel=""nofollow noopener"" target=""_blank"" title=""https://twitter.com/NadineDorries/status/1084540291372273664""><span class=""tco-ellipsis""></span><span class=""invisible"">https://</span><span class=""js-display-url"">twitter.com/NadineDorries/</span><span class=""invisible"">status/1084540291372273664</span><span class=""tco-ellipsis""><span class=""invisible""> </span>…</span></a></p>",['https://twitter.com/NadineDorries/status/1084540291372273664'],[],False,[],,0,0,0,False,False,,[],offensive_language,1
1123,1123,3985,3985,jackrooke,"Jack Rooke Pro 15""",158778164,1100346280608436225,/jackrooke/status/1100346280608436225,2019-02-26 10:46:11,1551177971,"Heidi Allen went for the wing roulette, no sides and that’s fucking brave. #Heidi4President2020https://twitter.com/ChukaUmunna/status/1100121204093009921 …","<p class=""TweetTextSize js-tweet-text tweet-text"" data-aria-label-part=""4"" lang=""en""><strong>Heidi Allen</strong> went for the wing roulette, no sides and that’s fucking brave. <a class=""twitter-hashtag pretty-link js-nav"" data-query-source=""hashtag_click"" dir=""ltr"" href=""/hashtag/Heidi4President2020?src=hash""><s>#</s><b>Heidi4President2020</b></a><a class=""twitter-timeline-link u-hidden"" data-expanded-url=""https://twitter.com/ChukaUmunna/status/1100121204093009921"" dir=""ltr"" href=""https://t.co/AhOsqDOe0L"" rel=""nofollow noopener"" target=""_blank"" title=""https://twitter.com/ChukaUmunna/status/1100121204093009921""><span class=""tco-ellipsis""></span><span class=""invisible"">https://</span><span class=""js-display-url"">twitter.com/ChukaUmunna/st</span><span class=""invisible"">atus/1100121204093009921</span><span class=""tco-ellipsis""><span class=""invisible""> </span>…</span></a></p>",['https://twitter.com/ChukaUmunna/status/1100121204093009921'],['Heidi4President2020https'],False,[],,9,0,0,False,False,,[],offensive_language,2
1125,1125,3757,3757,Kleisthines,temet nosce,94280943,1088722205305905152,/Kleisthines/status/1088722205305905152,2019-01-25 08:56:15,1548406575,If Heidi Allen can rattle Theresa May’s obdurate denial of the dire effects of her obscene austerity policies then good luck to her.z,"<p class=""TweetTextSize js-tweet-text tweet-text"" data-aria-label-part=""0"" lang=""en"">If <strong>Heidi Allen</strong> can rattle Theresa May’s obdurate denial of the dire effects of her obscene austerity policies then good luck to her.z</p>",[],[],False,[],,0,0,0,False,False,,[],offensive_language,1
1146,1146,1088,1088,DocTreen,Dr Kristen Treen,24091414,1072805766514511875,/DocTreen/status/1072805766514511875,2018-12-12 10:50:01,1544611801,"Good luck and great fortitude to you, Sav. At least it's Heidi Allen, who should give up being a Tory considering she blatantly doesn't agree with most of what's going on right now and provoked TM to say: ""No more Heidi Allens"". Still, makes her hard to shift.","<p class=""TweetTextSize js-tweet-text tweet-text"" data-aria-label-part=""0"" lang=""en"">Good luck and great fortitude to you, Sav. At least it's <strong>Heidi Allen</strong>, who should give up being a Tory considering she blatantly doesn't agree with most of what's going on right now and provoked TM to say: ""No more Heidi Allens"". Still, makes her hard to shift.</p>",[],[],False,[],,0,0,1,True,True,1.072763486290219e+18,"[{'screen_name': 'drjordansavage', 'user_id': '913041029330345984'}]",offensive_language,12
1178,1178,4285,4285,Daniel_Grigg,Daniel Grigg,44289341,1099668944061894656,/Daniel_Grigg/status/1099668944061894656,2019-02-24 13:54:41,1551016481,"All the anti-Corbyn attacks today are to distract from this from Theresa May, as Anna Soubry, Sarah Wollaston and Heidi Allen back her in no confidence votes. 

#FBPE, you're being played so hard by the people you're trusting.https://twitter.com/BethRigby/status/1099657089763459073 …","<p class=""TweetTextSize js-tweet-text tweet-text"" data-aria-label-part=""4"" lang=""en"">All the anti-Corbyn attacks today are to distract from this from Theresa May, as Anna Soubry, Sarah Wollaston and <strong>Heidi Allen</strong> back her in no confidence votes. 

<a class=""twitter-hashtag pretty-link js-nav"" data-query-source=""hashtag_click"" dir=""ltr"" href=""/hashtag/FBPE?src=hash""><s>#</s><b>FBPE</b></a>, you're being played so hard by the people you're trusting.<a class=""twitter-timeline-link u-hidden"" data-expanded-url=""https://twitter.com/BethRigby/status/1099657089763459073"" dir=""ltr"" href=""https://t.co/jZfCR91NW2"" rel=""nofollow noopener"" target=""_blank"" title=""https://twitter.com/BethRigby/status/1099657089763459073""><span class=""tco-ellipsis""></span><span class=""invisible"">https://</span><span class=""js-display-url"">twitter.com/BethRigby/stat</span><span class=""invisible"">us/1099657089763459073</span><span class=""tco-ellipsis""><span class=""invisible""> </span>…</span></a></p>",['https://twitter.com/BethRigby/status/1099657089763459073'],['FBPE'],False,[],,14,2,0,False,True,1.0996599260734136e+18,"[{'screen_name': 'aarjanistan', 'user_id': '964837051312082944'}, {'screen_name': 'lucianaberger', 'user_id': '20992801'}]",offensive_language,2
1202,1202,3713,3713,anotherwriter75,Julie Chandler,2935084607,1088743435736092672,/anotherwriter75/status/1088743435736092672,2019-01-25 10:20:37,1548411637,"I didn’t vote for my local MP @heidiallen75 and despair of Tory policy, but I do believe in her as one of the ‘good guys’. I’ve written to her on several occasions and found her to be genuine and open-minded in her approach.  https://www.theguardian.com/society/2019/jan/24/ive-absolutely-had-enough-tory-mp-embarks-on-anti-austerity-tour?CMP=share_btn_tw … #heidiallen","<p class=""TweetTextSize js-tweet-text tweet-text"" data-aria-label-part=""0"" lang=""en"">I didn’t vote for my local MP <a class=""twitter-atreply pretty-link js-nav"" data-mentioned-user-id=""426116125"" dir=""ltr"" href=""/heidiallen75""><s>@</s><b>heidiallen75</b></a> and despair of Tory policy, but I do believe in her as one of the ‘good guys’. I’ve written to her on several occasions and found her to be genuine and open-minded in her approach.  <a class=""twitter-timeline-link"" data-expanded-url=""https://www.theguardian.com/society/2019/jan/24/ive-absolutely-had-enough-tory-mp-embarks-on-anti-austerity-tour?CMP=share_btn_tw"" dir=""ltr"" href=""https://t.co/u69TS48ovO"" rel=""nofollow noopener"" target=""_blank"" title=""https://www.theguardian.com/society/2019/jan/24/ive-absolutely-had-enough-tory-mp-embarks-on-anti-austerity-tour?CMP=share_btn_tw""><span class=""tco-ellipsis""></span><span class=""invisible"">https://www.</span><span class=""js-display-url"">theguardian.com/society/2019/j</span><span class=""invisible"">an/24/ive-absolutely-had-enough-tory-mp-embarks-on-anti-austerity-tour?CMP=share_btn_tw</span><span class=""tco-ellipsis""><span class=""invisible""> </span>…</span></a> <a class=""twitter-hashtag pretty-link js-nav"" data-query-source=""hashtag_click"" dir=""ltr"" href=""/hashtag/heidiallen?src=hash""><s>#</s><b><strong>heidiallen</strong></b></a></p>",['https://www.theguardian.com/society/2019/jan/24/ive-absolutely-had-enough-tory-mp-embarks-on-anti-austerity-tour?CMP=share_btn_tw'],['heidiallen'],False,[],,26,1,8,True,False,,[],offensive_language,1
1244,1244,2736,2736,Nationstate_Dem,Steve Sheen,914568036539158528,1082999233899384833,/Nationstate_Dem/status/1082999233899384833,2019-01-09 13:55:13,1547042113,Heidi Allen needs reminding of what her job is pic.twitter.com/Cd6CMVTVYD,"<p class=""TweetTextSize js-tweet-text tweet-text"" data-aria-label-part=""0"" lang=""en""><strong>Heidi Allen</strong> needs reminding of what her job is <a class=""twitter-timeline-link u-hidden"" data-pre-embedded=""true"" dir=""ltr"" href=""https://t.co/Cd6CMVTVYD"">pic.twitter.com/Cd6CMVTVYD</a></p>",[],[],True,['https://pbs.twimg.com/media/DweWDrTXQAADKGf.jpg'],,0,0,0,False,True,1.0829947720323072e+18,"[{'screen_name': 'jameschappers', 'user_id': '53887085'}]",offensive_language,1
