,Unnamed: 0,Unnamed: 0.1,Unnamed: 0.1.1,screen_name,username,user_id,tweet_id,tweet_url,timestamp,timestamp_epochs,text,text_html,links,hashtags,has_media,img_urls,video_url,likes,retweets,replies,is_replied,is_reply_to,parent_tweet_id,reply_to_users,classofspeech,month
590,590,3810,3810,littleletters,luke,15506035,1088640318600302596,/littleletters/status/1088640318600302596,2019-01-25 03:30:52,1548387052,"same @heidiallen75 whose voting record is consistently in line with her government's austerity, the same heidi allen who last week voted to prop up that government. get to fuck with your crocodile tears. (and self-serving @frankfieldteam can do one too) https://www.theguardian.com/society/2019/jan/24/ive-absolutely-had-enough-tory-mp-embarks-on-anti-austerity-tour …","<p class=""TweetTextSize js-tweet-text tweet-text"" data-aria-label-part=""0"" lang=""en"">same <a class=""twitter-atreply pretty-link js-nav"" data-mentioned-user-id=""426116125"" dir=""ltr"" href=""/heidiallen75""><s>@</s><b>heidiallen75</b></a> whose voting record is consistently in line with her government's austerity, the same <strong>heidi allen</strong> who last week voted to prop up that government. get to fuck with your crocodile tears. (and self-serving <a class=""twitter-atreply pretty-link js-nav"" data-mentioned-user-id=""20688804"" dir=""ltr"" href=""/frankfieldteam""><s>@</s><b>frankfieldteam</b></a> can do one too) <a class=""twitter-timeline-link"" data-expanded-url=""https://www.theguardian.com/society/2019/jan/24/ive-absolutely-had-enough-tory-mp-embarks-on-anti-austerity-tour"" dir=""ltr"" href=""https://t.co/F1x86bGROr"" rel=""nofollow noopener"" target=""_blank"" title=""https://www.theguardian.com/society/2019/jan/24/ive-absolutely-had-enough-tory-mp-embarks-on-anti-austerity-tour""><span class=""tco-ellipsis""></span><span class=""invisible"">https://www.</span><span class=""js-display-url"">theguardian.com/society/2019/j</span><span class=""invisible"">an/24/ive-absolutely-had-enough-tory-mp-embarks-on-anti-austerity-tour</span><span class=""tco-ellipsis""><span class=""invisible""> </span>…</span></a></p>",['https://www.theguardian.com/society/2019/jan/24/ive-absolutely-had-enough-tory-mp-embarks-on-anti-austerity-tour'],[],False,[],,2,1,1,True,False,,[],offensive_language,1
594,594,2673,2673,obknit,Jo Hugh,966903620,1083700776533405696,/obknit/status/1083700776533405696,2019-01-11 12:22:53,1547209373,How terribly apt Heidi Allen would choose a camera angle for herself looking straight down her nose. She might start getting something right occasionally if she looked *up* to her constituents & her countrymen in general. She sure could use being taught a lesson. #politicslive,"<p class=""TweetTextSize js-tweet-text tweet-text"" data-aria-label-part=""0"" lang=""en"">How terribly apt <strong>Heidi Allen</strong> would choose a camera angle for herself looking straight down her nose. She might start getting something right occasionally if she looked *up* to her constituents &amp; her countrymen in general. She sure could use being taught a lesson. <a class=""twitter-hashtag pretty-link js-nav"" data-query-source=""hashtag_click"" dir=""ltr"" href=""/hashtag/politicslive?src=hash""><s>#</s><b>politicslive</b></a></p>",[],['politicslive'],False,[],,2,1,0,False,False,,[],offensive_language,1
647,647,618,618,AndrewTottenham,Andrew Tottenham# Revoker #StopTheCoup,766439234,1056507127362215936,/AndrewTottenham/status/1056507127362215936,2018-10-28 11:25:02,1540725902,"Ah, but she can change her mind ( but the electorate cannot on #Brexit)","<p class=""TweetTextSize js-tweet-text tweet-text"" data-aria-label-part=""0"" lang=""en"">Ah, but she can change her mind ( but the electorate cannot on <a class=""twitter-hashtag pretty-link js-nav"" data-query-source=""hashtag_click"" dir=""ltr"" href=""/hashtag/Brexit?src=hash""><s>#</s><b>Brexit</b></a>)</p>",[],['Brexit'],False,[],,0,0,0,False,True,1.0564669646994063e+18,"[{'screen_name': 'ComeOnCov', 'user_id': '216471322'}, {'screen_name': 'andreajenkyns', 'user_id': '1350441445'}]",offensive_language,10
702,702,2596,2596,katecharles1956,kathleen charles,1495563679,1084114526541410304,/katecharles1956/status/1084114526541410304,2019-01-12 15:46:59,1547308019,"I’m sure you’re a very nice person Heidi Allen but you won’t even admit that your govn has created POVERTY, HOMELESSNESS, IN WORK&CHILD POVERTY. IF EVERYTHING HAS BEEN CUT HOW DO YOU LIVE? CAN YOU LIVE ON £20PER WEEK. READ THE UN REPORT!! STOP BEING IN DENIAL https://twitter.com/heidiallen75/status/1083878490825506816 …","<p class=""TweetTextSize js-tweet-text tweet-text"" data-aria-label-part=""4"" lang=""en"">I’m sure you’re a very nice person <strong>Heidi Allen</strong> but you won’t even admit that your govn has created POVERTY, HOMELESSNESS, IN WORK&amp;CHILD POVERTY. IF EVERYTHING HAS BEEN CUT HOW DO YOU LIVE? CAN YOU LIVE ON £20PER WEEK. READ THE UN REPORT!! STOP BEING IN DENIAL <a class=""twitter-timeline-link u-hidden"" data-expanded-url=""https://twitter.com/heidiallen75/status/1083878490825506816"" dir=""ltr"" href=""https://t.co/LbzQMYdZM0"" rel=""nofollow noopener"" target=""_blank"" title=""https://twitter.com/heidiallen75/status/1083878490825506816""><span class=""tco-ellipsis""></span><span class=""invisible"">https://</span><span class=""js-display-url"">twitter.com/heidiallen75/s</span><span class=""invisible"">tatus/1083878490825506816</span><span class=""tco-ellipsis""><span class=""invisible""> </span>…</span></a></p>",['https://twitter.com/heidiallen75/status/1083878490825506816'],[],False,[],,11,4,1,True,False,,[],offensive_language,1
719,719,2498,2498,sandieshoes,sandieshoes,2170986966,1084575692786933760,/sandieshoes/status/1084575692786933760,2019-01-13 22:19:30,1547417970,"Lol Maggie wouldn’t have put up with the bullshit from Tusk, Merkel, Juncker or Verhofstadt either. 

Nor would the likes of Heidi Allen have run circles around her.","<p class=""TweetTextSize js-tweet-text tweet-text"" data-aria-label-part=""0"" lang=""en"">Lol Maggie wouldn’t have put up with the bullshit from Tusk, Merkel, Juncker or Verhofstadt either. 

Nor would the likes of <strong>Heidi Allen</strong> have run circles around her.</p>",[],[],False,[],,2,0,0,False,True,1.084442189470593e+18,"[{'screen_name': 'erniehoff1', 'user_id': '3997275863'}, {'screen_name': 'heidiallen75', 'user_id': '426116125'}, {'screen_name': 'JaneMundon', 'user_id': '185576358'}]",offensive_language,1
739,739,354,354,ThomasEvans1984,Thomas Evans (Liberal Brexiteer) ✝️✡️☪️☮️🕉️☸️,51052182,1071165777368244225,/ThomasEvans1984/status/1071165777368244225,2018-12-07 22:13:17,1544220797,"Watching through 2 hrs of footage at Heidi Allen's meeting earlier today discussing Brexit with her three-quarters Brexit opposing constituents. (I do make sacrifices #EarsBleeding)
4 mins in, she has already said she prefers debating in her area as people are ""more intelligent"".","<p class=""TweetTextSize js-tweet-text tweet-text"" data-aria-label-part=""0"" lang=""en"">Watching through 2 hrs of footage at <strong>Heidi Allen</strong>'s meeting earlier today discussing Brexit with her three-quarters Brexit opposing constituents. (I do make sacrifices <a class=""twitter-hashtag pretty-link js-nav"" data-query-source=""hashtag_click"" dir=""ltr"" href=""/hashtag/EarsBleeding?src=hash""><s>#</s><b>EarsBleeding</b></a>)
4 mins in, she has already said she prefers debating in her area as people are ""more intelligent"".</p>",[],['EarsBleeding'],False,[],,17,8,4,True,False,,[],offensive_language,12
743,743,3312,3312,Annette1Hardy,Annette Hardy,362001923,1090941008068730881,/Annette1Hardy/status/1090941008068730881,2019-01-31 11:52:59,1548935579,"I can tell! What about Heidi Allen, who is also negative and seems to speak against her party all the time? Was she also selected by open primary?","<p class=""TweetTextSize js-tweet-text tweet-text"" data-aria-label-part=""0"" lang=""en"">I can tell! What about <strong>Heidi Allen</strong>, who is also negative and seems to speak against her party all the time? Was she also selected by open primary?</p>",[],[],False,[],,0,0,1,True,True,1.0909263914141778e+18,"[{'screen_name': 'AidanKiely2', 'user_id': '2230140391'}]",offensive_language,1
751,751,3462,3462,JuneMay63903038,June May,869577012981137410,1089504237833371648,/JuneMay63903038/status/1089504237833371648,2019-01-27 12:43:46,1548593026,"Heidi Allen would not allow such a question. It would defeat her use of Food Banks, a godsend to her image with her targeted audience. 

Her strategy works. The English vote for greed, violence, hatred  & hypocrisy with a pretty face. The rest of the world is stunned! pic.twitter.com/4PVxBlLHRU","<p class=""TweetTextSize js-tweet-text tweet-text"" data-aria-label-part=""0"" lang=""en""><strong>Heidi Allen</strong> would not allow such a question. It would defeat her use of Food Banks, a godsend to her image with her targeted audience. 

Her strategy works. The English vote for greed, violence, hatred  &amp; hypocrisy with a pretty face. The rest of the world is stunned! <a class=""twitter-timeline-link u-hidden"" data-pre-embedded=""true"" dir=""ltr"" href=""https://t.co/4PVxBlLHRU"">pic.twitter.com/4PVxBlLHRU</a></p>",[],[],True,['https://pbs.twimg.com/media/Dx6xdlTWsAAY49r.jpg'],,3,1,1,True,True,1.0888600005445878e+18,"[{'screen_name': 'Badgersgetabad', 'user_id': '1457029500'}, {'screen_name': 'Rachael_Swindon', 'user_id': '2870848881'}]",offensive_language,1
762,762,1572,1572,NatashaC,Natasha Clark,56737634,1055021647382675456,/NatashaC/status/1055021647382675456,2018-10-24 09:02:16,1540371736,"Heidi Allen says the income threshold for parents getting 30 hours free childcare is ""potty"" and far too high  - you can get it if you earn up to £100k. All the experts agree with her","<p class=""TweetTextSize js-tweet-text tweet-text"" data-aria-label-part=""0"" lang=""en""><strong>Heidi Allen</strong> says the income threshold for parents getting 30 hours free childcare is ""potty"" and far too high  - you can get it if you earn up to £100k. All the experts agree with her</p>",[],[],False,[],,13,3,6,True,False,,[],offensive_language,10
766,766,1740,1740,Socrates216,Paul Hodges,92865347,1053408824395251712,/Socrates216/status/1053408824395251712,2018-10-19 22:13:29,1539987209,"TORY MP HEIDI ALLEN, is just another WHITE NIGGARD NAZI WHORE... ! https://twitter.com/SocialistVoice/status/1053391172226428929 …","<p class=""TweetTextSize js-tweet-text tweet-text"" data-aria-label-part=""4"" lang=""en"">TORY MP <strong>HEIDI ALLEN</strong>, is just another WHITE NIGGARD NAZI WHORE... ! <a class=""twitter-timeline-link u-hidden"" data-expanded-url=""https://twitter.com/SocialistVoice/status/1053391172226428929"" dir=""ltr"" href=""https://t.co/R6c9bvSrFm"" rel=""nofollow noopener"" target=""_blank"" title=""https://twitter.com/SocialistVoice/status/1053391172226428929""><span class=""tco-ellipsis""></span><span class=""invisible"">https://</span><span class=""js-display-url"">twitter.com/SocialistVoice</span><span class=""invisible"">/status/1053391172226428929</span><span class=""tco-ellipsis""><span class=""invisible""> </span>…</span></a></p>",['https://twitter.com/SocialistVoice/status/1053391172226428929'],[],False,[],,0,0,0,False,False,,[],offensive_language,10
773,773,1728,1728,rachellh,RHubbard #RegisterPostalVote #VoteLabour12December,22520029,1053657760393560064,/rachellh/status/1053657760393560064,2018-10-20 14:42:40,1540046560,"2/ Despite her rhetoric,Heidi Allen consistently voted for Tory reforms. Her latest callous decision removes all doubt she cares about her own career above people’s lives. No matter how much Tories try to convince public,truly no compassionate Conservative https://evolvepolitics.com/tory-mp-who-cried-at-universal-credit-horror-stories-votes-to-block-universal-credit-impact-assessment-publication/ …","<p class=""TweetTextSize js-tweet-text tweet-text"" data-aria-label-part=""0"" lang=""en"">2/ Despite her rhetoric,<strong>Heidi Allen</strong> consistently voted for Tory reforms. Her latest callous decision removes all doubt she cares about her own career above people’s lives. No matter how much Tories try to convince public,truly no compassionate Conservative <a class=""twitter-timeline-link"" data-expanded-url=""https://evolvepolitics.com/tory-mp-who-cried-at-universal-credit-horror-stories-votes-to-block-universal-credit-impact-assessment-publication/"" dir=""ltr"" href=""https://t.co/4rI6syXSTe"" rel=""nofollow noopener"" target=""_blank"" title=""https://evolvepolitics.com/tory-mp-who-cried-at-universal-credit-horror-stories-votes-to-block-universal-credit-impact-assessment-publication/""><span class=""tco-ellipsis""></span><span class=""invisible"">https://</span><span class=""js-display-url"">evolvepolitics.com/tory-mp-who-cr</span><span class=""invisible"">ied-at-universal-credit-horror-stories-votes-to-block-universal-credit-impact-assessment-publication/</span><span class=""tco-ellipsis""><span class=""invisible""> </span>…</span></a></p>",['https://evolvepolitics.com/tory-mp-who-cried-at-universal-credit-horror-stories-votes-to-block-universal-credit-impact-assessment-publication/'],[],False,[],,0,0,0,False,False,,[],offensive_language,10
788,788,1176,1176,couch_ian,I'm a Dumb Bum Brexiteer...,776001374,1063886851575070720,/couch_ian/status/1063886851575070720,2018-11-17 20:09:26,1542485366,"@Conservatives I'm disgusted with your handling of an Overwhelming Majority Demoratic Vote 2 leave a Sunken EU project

Hence I'll be Giving Heidi Allen MP.
My Medals That Represent All My Dead Comrades & Friends That Died For A Once Gt Britain That Is Never More Until Unshackled pic.twitter.com/c69Rm1YfQZ","<p class=""TweetTextSize js-tweet-text tweet-text"" data-aria-label-part=""0"" lang=""en""><a class=""twitter-atreply pretty-link js-nav"" data-mentioned-user-id=""14281853"" dir=""ltr"" href=""/Conservatives""><s>@</s><b>Conservatives</b></a> I'm disgusted with your handling of an Overwhelming Majority Demoratic Vote 2 leave a Sunken EU project

Hence I'll be Giving <strong>Heidi Allen</strong> MP.
My Medals That Represent All My Dead Comrades &amp; Friends That Died For A Once Gt Britain That Is Never More Until Unshackled <a class=""twitter-timeline-link u-hidden"" data-pre-embedded=""true"" dir=""ltr"" href=""https://t.co/c69Rm1YfQZ"">pic.twitter.com/c69Rm1YfQZ</a></p>",[],[],True,['https://pbs.twimg.com/media/DsOvcKLWkAIO_Si.jpg'],,1,0,0,False,False,,[],offensive_language,11
816,816,2213,2213,MrJDoly60,THE SPAFFMEISTER..,290706305,1087295803469778944,/MrJDoly60/status/1087295803469778944,2019-01-21 10:28:15,1548066495,"Heidi Allen, is full of shit!","<p class=""TweetTextSize js-tweet-text tweet-text"" data-aria-label-part=""0"" lang=""en""><strong>Heidi Allen</strong>, is full of shit!</p>",[],[],False,[],,2,0,0,False,True,1.0872789001730294e+18,"[{'screen_name': 'heidiallen75', 'user_id': '426116125'}]",offensive_language,1
838,838,1835,1835,LovattWinifred,Winifred Lovatt,1002652112357076993,1052110510160797696,/LovattWinifred/status/1052110510160797696,2018-10-16 08:14:27,1539677667,#Conservatives what happens when illegal migrant commits crime in Cambridgeshire and God forbid murders someone and it comes to light that Heidi Allen has never even reported they were there. You could be sued to hell and gone by the family of the murdered person. Deal with her.,"<p class=""TweetTextSize js-tweet-text tweet-text"" data-aria-label-part=""0"" lang=""en""><a class=""twitter-hashtag pretty-link js-nav"" data-query-source=""hashtag_click"" dir=""ltr"" href=""/hashtag/Conservatives?src=hash""><s>#</s><b>Conservatives</b></a> what happens when illegal migrant commits crime in Cambridgeshire and God forbid murders someone and it comes to light that <strong>Heidi Allen</strong> has never even reported they were there. You could be sued to hell and gone by the family of the murdered person. Deal with her.</p>",[],['Conservatives'],False,[],,1,0,0,False,True,1.0519706791160914e+18,"[{'screen_name': 'alb353', 'user_id': '414752057'}]",offensive_language,10
873,873,3310,3310,cranleycranley2,Cranley,830375643368005633,1090960619724029952,/cranleycranley2/status/1090960619724029952,2019-01-31 13:10:55,1548940255,They're trying to rework her image (like they're also doing to Frank Field and Heidi Allen) and turn her into a 'caring woman of the people' when she's anything but.,"<p class=""TweetTextSize js-tweet-text tweet-text"" data-aria-label-part=""0"" lang=""en"">They're trying to rework her image (like they're also doing to Frank Field and <strong>Heidi Allen</strong>) and turn her into a 'caring woman of the people' when she's anything but.</p>",[],[],False,[],,2,0,0,False,True,1.0909255697542596e+18,"[{'screen_name': 'tedtully', 'user_id': '1336803638'}, {'screen_name': 'Ahoberg1Ahoberg', 'user_id': '746851371538849792'}, {'screen_name': 'graham_budden', 'user_id': '982974299932975105'}]",offensive_language,1
884,884,1253,1253,tranceketeer,Neil Cummins #FBPE full time European.,54857390,1062988316096770048,/tranceketeer/status/1062988316096770048,2018-11-15 08:38:58,1542271138,Personally think not only does Heidi Allen know what she is talking about but she is ,"<p class=""TweetTextSize js-tweet-text tweet-text"" data-aria-label-part=""0"" lang=""en"">Personally think not only does <strong>Heidi Allen</strong> know what she is talking about but she is <img alt=""😍"" aria-label=""Emoji: Smiling face with heart-shaped eyes"" class=""Emoji Emoji--forText"" draggable=""false"" src=""https://abs.twimg.com/emoji/v2/72x72/1f60d.png"" title=""Smiling face with heart-shaped eyes""/><img alt=""😍"" aria-label=""Emoji: Smiling face with heart-shaped eyes"" class=""Emoji Emoji--forText"" draggable=""false"" src=""https://abs.twimg.com/emoji/v2/72x72/1f60d.png"" title=""Smiling face with heart-shaped eyes""/><img alt=""😍"" aria-label=""Emoji: Smiling face with heart-shaped eyes"" class=""Emoji Emoji--forText"" draggable=""false"" src=""https://abs.twimg.com/emoji/v2/72x72/1f60d.png"" title=""Smiling face with heart-shaped eyes""/><img alt=""😍"" aria-label=""Emoji: Smiling face with heart-shaped eyes"" class=""Emoji Emoji--forText"" draggable=""false"" src=""https://abs.twimg.com/emoji/v2/72x72/1f60d.png"" title=""Smiling face with heart-shaped eyes""/></p>",[],[],False,[],,0,0,0,False,True,1.062850702106456e+18,"[{'screen_name': 'itvpeston', 'user_id': '709863948686909441'}, {'screen_name': 'gavin_steven', 'user_id': '2687849290'}]",offensive_language,11
910,910,3633,3633,MartinButler17,Martin Butler,1436627946,1088829619200016387,/MartinButler17/status/1088829619200016387,2019-01-25 16:03:05,1548432185,"Not the  best way to proceed.  Millions of 'ordinary' people voted this government in and would probably agree with those awful changes. It is not going to persuade  Heidi Allen, or the electorate,  of the error of their ways  by calling them 'pure fucking evil'. HA is redeemable","<p class=""TweetTextSize js-tweet-text tweet-text"" data-aria-label-part=""0"" lang=""en"">Not the  best way to proceed.  Millions of 'ordinary' people voted this government in and would probably agree with those awful changes. It is not going to persuade  <strong>Heidi Allen</strong>, or the electorate,  of the error of their ways  by calling them 'pure fucking evil'. HA is redeemable</p>",[],[],False,[],,0,0,0,False,True,1.0887758138377871e+18,"[{'screen_name': 'KazzJenkins', 'user_id': '257606752'}]",offensive_language,1
919,919,1910,1910,EUVoteLeave23rd,BREXIT BRITAIN Supporting BREXIT & LEAVE ALLIANCE!,701866563268378626,1097460801856778241,/EUVoteLeave23rd/status/1097460801856778241,2019-02-18 11:40:19,1550490019,"You have your calling #AnnaSoubry @Anna_Soubry, #HeidiAllen @heidiallen75, #SarahWollaston @sarahwollaston and #DominicGreive ....... what are you waiting for, you know you want tohttps://twitter.com/Steven_Swinford/status/1097444696928997376 …","<p class=""TweetTextSize js-tweet-text tweet-text"" data-aria-label-part=""4"" lang=""en"">You have your calling <a class=""twitter-hashtag pretty-link js-nav"" data-query-source=""hashtag_click"" dir=""ltr"" href=""/hashtag/AnnaSoubry?src=hash""><s>#</s><b>AnnaSoubry</b></a> <a class=""twitter-atreply pretty-link js-nav"" data-mentioned-user-id=""326184301"" dir=""ltr"" href=""/Anna_Soubry""><s>@</s><b>Anna_Soubry</b></a>, <a class=""twitter-hashtag pretty-link js-nav"" data-query-source=""hashtag_click"" dir=""ltr"" href=""/hashtag/HeidiAllen?src=hash""><s>#</s><b><strong>HeidiAllen</strong></b></a> <a class=""twitter-atreply pretty-link js-nav"" data-mentioned-user-id=""426116125"" dir=""ltr"" href=""/heidiallen75""><s>@</s><b>heidiallen75</b></a>, <a class=""twitter-hashtag pretty-link js-nav"" data-query-source=""hashtag_click"" dir=""ltr"" href=""/hashtag/SarahWollaston?src=hash""><s>#</s><b>SarahWollaston</b></a> <a class=""twitter-atreply pretty-link js-nav"" data-mentioned-user-id=""460401829"" dir=""ltr"" href=""/sarahwollaston""><s>@</s><b>sarahwollaston</b></a> and <a class=""twitter-hashtag pretty-link js-nav"" data-query-source=""hashtag_click"" dir=""ltr"" href=""/hashtag/DominicGreive?src=hash""><s>#</s><b>DominicGreive</b></a> ....... what are you waiting for, you know you want to<img alt=""👍"" aria-label=""Emoji: Thumbs up sign"" class=""Emoji Emoji--forText"" draggable=""false"" src=""https://abs.twimg.com/emoji/v2/72x72/1f44d.png"" title=""Thumbs up sign""/><a class=""twitter-timeline-link u-hidden"" data-expanded-url=""https://twitter.com/Steven_Swinford/status/1097444696928997376"" dir=""ltr"" href=""https://t.co/A6OYENy5RE"" rel=""nofollow noopener"" target=""_blank"" title=""https://twitter.com/Steven_Swinford/status/1097444696928997376""><span class=""tco-ellipsis""></span><span class=""invisible"">https://</span><span class=""js-display-url"">twitter.com/Steven_Swinfor</span><span class=""invisible"">d/status/1097444696928997376</span><span class=""tco-ellipsis""><span class=""invisible""> </span>…</span></a></p>",['https://twitter.com/Steven_Swinford/status/1097444696928997376'],"['AnnaSoubry', 'HeidiAllen', 'SarahWollaston', 'DominicGreive']",False,[],,15,5,1,True,False,,[],offensive_language,2
926,926,3831,3831,grahamlithgow,Graham Lithgow,3029947101,1100863793746374656,/grahamlithgow/status/1100863793746374656,2019-02-27 21:02:36,1551301356,"If you're still unsure as to whether Heidi Allen made the right decision in leaving the Tories, just remember that she doesn't haven't to hang around with embittered joy vacuum Nadine Dorries anymore. pic.twitter.com/yGYOPSmVAM","<p class=""TweetTextSize js-tweet-text tweet-text"" data-aria-label-part=""0"" lang=""en"">If you're still unsure as to whether <strong>Heidi Allen</strong> made the right decision in leaving the Tories, just remember that she doesn't haven't to hang around with embittered joy vacuum Nadine Dorries anymore. <a class=""twitter-timeline-link u-hidden"" data-pre-embedded=""true"" dir=""ltr"" href=""https://t.co/yGYOPSmVAM"">pic.twitter.com/yGYOPSmVAM</a></p>",[],[],True,['https://pbs.twimg.com/media/D0cLR9PV4AAka1K.png'],,30,4,2,True,False,,[],offensive_language,2
935,935,1786,1786,RosieCharrot,Rosie Kainja Charrot,792293192557268992,1052810209930989569,/RosieCharrot/status/1052810209930989569,2018-10-18 06:34:48,1539844488,Typical with Heidi Allen. I don’t like her at all. https://twitter.com/Gerribird/status/1052798659442745344 …,"<p class=""TweetTextSize js-tweet-text tweet-text"" data-aria-label-part=""4"" lang=""en"">Typical with <strong>Heidi Allen</strong>. I don’t like her at all. <a class=""twitter-timeline-link u-hidden"" data-expanded-url=""https://twitter.com/Gerribird/status/1052798659442745344"" dir=""ltr"" href=""https://t.co/0xKbauuCo3"" rel=""nofollow noopener"" target=""_blank"" title=""https://twitter.com/Gerribird/status/1052798659442745344""><span class=""tco-ellipsis""></span><span class=""invisible"">https://</span><span class=""js-display-url"">twitter.com/Gerribird/stat</span><span class=""invisible"">us/1052798659442745344</span><span class=""tco-ellipsis""><span class=""invisible""> </span>…</span></a></p>",['https://twitter.com/Gerribird/status/1052798659442745344'],[],False,[],,0,1,0,False,False,,[],offensive_language,10
951,951,817,817,frankroberts132,Frank Roberts,815008701320929281,1037672182686593025,/frankroberts132/status/1037672182686593025,2018-09-06 12:01:42,1536235302,"Heidi Allen vowed to quit if Rees-Mogg was leader now she wants to quit if Boris becomes leader. If she is so disconnected from the views of her party membership surely she should leave anyway. Very little Conservatism in her politics, merely a weak dose of socialism","<p class=""TweetTextSize js-tweet-text tweet-text"" data-aria-label-part=""0"" lang=""en""><strong>Heidi Allen</strong> vowed to quit if Rees-Mogg was leader now she wants to quit if Boris becomes leader. If she is so disconnected from the views of her party membership surely she should leave anyway. Very little Conservatism in her politics, merely a weak dose of socialism</p>",[],[],False,[],,15,9,1,True,True,1.0376342355096945e+18,"[{'screen_name': 'ArchRose90', 'user_id': '1647291168'}, {'screen_name': 'JamesDelingpole', 'user_id': '15798091'}, {'screen_name': 'ConHome', 'user_id': '159992511'}]",offensive_language,9
