,date,name,tweet,stance
212,08,Tom Watson,"Back in May, I wrote to the Culture Secretary saying that we need to clean up the gambling industry. Stories like this reinforce that view - and are exactly why we need a full overhaul of all remote gambling licences. https://twitter.com/thetimes/status/1160317545490079745 …",leave
213,08,Tom Watson,"Gordon Brown has warned that the future of the Union is under grave threat from no-deal and the rising tide of nationalism in Scotland, England, Wales and NI. Gordon's absolutely right to raise the alarm. It's time to make the case for the Union. https://www.tom-watson.com/the_case_for_the_union …",leave
214,08,Tom Watson,"Leaving the UK would turbo-charge austerity in Scotland with the inevitable threat to 1000s of jobs. More nationalism, uncertainty, and division isn’t the answer. We need to reassert shared values of fairness and respect, and remember we can achieve far more together than apart. pic.twitter.com/2vmkQsLo3e",leave
215,08,Tom Watson,Very sad to see an experienced and creative campaigner leave our ranks. Brian has served the Labour Party with distinction and will be missed. https://twitter.com/BrianFrancisRoy/status/1159799620253491201 …,irrelevant
216,08,Tom Watson,Eid Mubarak to all my friends and everyone celebrating #EidAlAdha today around the world. pic.twitter.com/6BBjTnVzPI,irrelevant
217,08,Tom Watson,I feel sure Dominic Cummings would be the first to agree this money could have been better spent on the NHS. https://www.theguardian.com/politics/2019/aug/10/dominic-cummings-owns-farm-got-eu-subsidy …,irrelevant
218,08,Tom Watson,"The great Tory myth is they're good stewards of the economy. But a tanking economy and threat of a disastrous no deal blows that apart. Johnson and chums won't suffer. People like my constituents will, with price hikes and job losses. Labour will fight no deal with all we've got. pic.twitter.com/u6LnjJPri5",leave
219,08,Tom Watson,I’m definitely not doing that. I admire him greatly. It’s the governance arrangements I’m concerned about.,leave
220,08,Tom Watson,@helenlewis I know it wasn’t the intention but...Jeremy Fisher.,leave
221,08,Tom Watson,Wayne Rooney and @dcfcofficial's 32Red deal is concerning and highlights a fundamental problem with football governance. The system prioritises profit over fan welfare. Football governance needs to change and do far more to protect the public. https://www.itv.com/news/2019-08-09/church-of-england-slams-wayne-rooney-over-deal-with-gambling-firm/ …,irrelevant
222,08,Tom Watson,Today's revelations about schoolchildren blackmailed into internships and forced overtime by an Amazon contractor are as sickening as they are predictable. Alexa: reform global capitalism. https://www.google.com/amp/s/amp.theguardian.com/global-development/2019/aug/08/schoolchildren-in-china-work-overnight-to-produce-amazon-alexa-devices …,irrelevant
223,08,Tom Watson,I'm delighted that the Rail Delivery Group listened to Labour's concerns and reversed the decision to leave Interrail and Eurail. This news will be welcomed by travellers and tourist destinations right across the UK. It’s a victory for common sense. pic.twitter.com/Tl4nlyZZdx,leave
224,08,Tom Watson,"Exiting Interrail is self-defeating and regressive. I've written to @RailDeliveryGrp and  @NickyMorgan01 urging they stop this harmful blow to tourism. This kind of isolationism is not who we are, and not the Britain we should promote to the world. https://www.mirror.co.uk/news/politics/labour-say-uk-pulling-out-18862177 …",leave
225,08,Tom Watson,"It’s #Farm24 day, our chance to thank the country’s farmers for the food they give us. Also, don’t forget to eat more #eggs - and don’t worry to much about the #butter either. What do you think of this spectacular blue orpington bantam hen? pic.twitter.com/HwYbr1LYms",irrelevant
226,08,Tom Watson,This is @AndyMcDonaldMP’s response to the interrail announcement. pic.twitter.com/77NeCL23AD,leave
227,08,Tom Watson,This is a good initiative for employers to get involved in. https://twitter.com/ShivajiShivaLaw/status/1157590771027140610 …,stay
228,08,Tom Watson,And a generation of young adventurers lose out because of privatised interests. Copying in @AndyMcDonaldMP who I’m sure will be appalled by this isolationist and self-defeating announcement https://twitter.com/seatsixtyone/status/1159029657347534848 …,leave
229,08,Tom Watson,The hired hand consciously making himself the story. https://twitter.com/SkyNews/status/1159026840134139904 …,irrelevant
230,08,Tom Watson,"The £'s fall to record lows is fuelling sky high holiday prices. Now 4.6m under 16s stand to lose vital travel cover, leaving millions of families to face extra charges. Johnson must urgently rethink and take his senseless no deal Brexit off the table. http://www.mirror.co.uk/news/politics/holiday-bills-set-soar-no-18826469 …",leave
231,08,Tom Watson,"Well, pounds is what I know, despite being taught in metric. And I don’t want to share my caliper and dexa scan data. I’m obsessively ‘2019’ about it though!",no sentiment
232,08,Tom Watson,"I’ve hardly eaten bread for nearly two years but I would scoff this, with a lot of butter, very fast. https://twitter.com/SeamusBlackley/status/1158264819503419392 …",leave
233,08,Tom Watson,Alan Johnson is not just a beautiful author and a brilliant politician but also a mean guitarist. Here's a classic from the vaults featuring the great man - Hard Life by The Area. Let's get it trending twitter! #HardLife https://youtu.be/zDzd8RkBbQs ,leave
234,08,Tom Watson,I knew you’d say that!!,stay
235,08,Tom Watson,"In three months I've climbed Snowdon, canoed 9 miles of Black Country canals, and now completed a 46 mile bike ride. Try telling the me of 2 years ago - 100lbs heavier with T2 diabetes - this would be my summer of 2019 and I wouldn't have believed you. http://www.tom-watson.com/the_summer_of_2019_special_edition …",leave
236,08,Tom Watson,"I'm raising money for four fabulous charities 
@lumos @WBAFoundation @cftrust @SpecialEffect. Thanks for all the support so far. If you would like to donate you can do so here. https://uk.virginmoneygiving.com/fundraiser-display/showROFundraiserPage?userUrl=TomWatsonMP&pageUrl=1 …",leave
237,08,Tom Watson,I have gone from utter trepidation early this morning to total elation this afternoon. That is the third of my #Adventures4Health done and dusted. What a great feeling to have completed the Prudential RideLondon-Surrey 46. #ridelondon pic.twitter.com/wMAxe0m9G9,leave
238,08,Tom Watson,"And special thanks to my amazing team colleagues 
@OIAUKCEO @JGurling @MarkHenryGlover and @ruthcadbury",irrelevant
239,08,Tom Watson,Job done! That's me in the grey top and white helmet crossing the finishing line in 3hrs 14 mins in today's Prudential RideLondon-Surrey 46. Thanks everyone for your amazing messages of support. #Adventures4Health #ridelondon pic.twitter.com/cimD1A3omQ,irrelevant
240,08,Tom Watson,"Along the way we are raising money for four fabulous charities @lumos @WBAFoundation @cftrust @SpecialEffect. 
Thanks for all the support so far. If you would like to donate you can do so here. https://uk.virginmoneygiving.com/fundraiser-display/showROFundraiserPage?userUrl=TomWatsonMP&pageUrl=1 …",leave
241,08,Tom Watson,"We're off! Only 46 miles to go on my third #Adventures4Health challenge as I take on Prudential RideLondon-Surrey 46 with @OIAUKCEO @JGurling @MarkHenryGlover and @ruthcadbury. Two years ago, 100lbs heavier with T2 diabetes, this was a distant dream.
 
Wish us luck! #ridelondon pic.twitter.com/g4HbRTyte7",no sentiment
242,08,Tom Watson,"You’ll be fine. I’ll be behind you all of the way, for sure!",stay
243,08,Tom Watson,Early start for the most intrepid cyclists. https://twitter.com/RideLondon/status/1157878945104171009 …,irrelevant
244,08,Tom Watson,Thank you great man. That’s very much appreciated.,stay
245,08,Tom Watson,"Along the way we are raising money for four fabulous charities @lumos @WBAFoundation @cftrust @SpecialEffect. Thanks for all the support so far. If you would like to donate you can do so here.
 https://uk.virginmoneygiving.com/fundraiser-display/showROFundraiserPage?userUrl=TomWatsonMP&pageUrl=1 …",irrelevant
246,08,Tom Watson,"Nervous and excited in equal measure about my third #Adventures4Health challenge tomorrow, taking on Prudential RideLondon-Surrey 46 with @OIAUKCEO @JGurling @MarkHenryGlover.  I strongly suspect this is going to be the hardest challenge yet! #ridelondon http://www.tom-watson.com/adventures_4_health …",no sentiment
247,08,Tom Watson,"634,789 reasons for Boris Johnson to do the right thing - instead of breaking the 2017 Tory election manifesto promise - and save the free TV licence for over 75s. Proud to have supported this brilliant @ageukcampaigns #freeTVlicence http://www.express.co.uk/news/uk/1160796/tv-licence-free-bbc-age-uk-petition-boris-johnson …",leave
248,08,Tom Watson,Gamer’s voice! What a thing that was.,no sentiment
249,08,Tom Watson,"Lynton Crosby's company majors in dark digital ads running secretive campaigns for Saudi Arabia and major polluters. Yet Facebook says CTF does not breach its ""coordinated inauthentic behaviour” policy. I suggest Facebook takes another look. https://www.theguardian.com/politics/2019/aug/01/revealed-johnson-allys-firm-secretly-ran-facebook-propaganda-network?CMP=Share_AndroidApp_Copy_to_clipboard …",irrelevant
250,08,Tom Watson,Great to see Labour's policy of a whistle-to-whistle ban enacted today by the gambling companies. Next stop must be a ban on debt-fuelled gambling with credit cards and a mandatory levy on firms to fund addiction treatment. https://www.theguardian.com/society/2019/aug/01/gambling-advert-ban-takes-effect-from-start-of-ashes?utm_source=dlvr.it&utm_medium=twitter …,irrelevant
251,08,Tom Watson,"This summer has reignited the public’s love of cricket. Yet opportunities to play cricket in school are dwindling, with 80 pitches lost since the Tories came to power. The austerity attack on grassroots sports facilities must end. https://www.independent.co.uk/news/uk/politics/ashes-2019-school-cricket-pitches-england-conservatives-pitch-a9030451.html …",stay
252,07,Tom Watson,I’m sure this view is shared by all the front bench DCMS teams in Westminster when I say this is a very good appointment. https://twitter.com/_ukactive/status/1156204083247800320 …,leave
253,07,Tom Watson,"Charities warn that hospital patients, care home residents and food bank users will be first to suffer when a no deal Brexit holds up vital food supplies. Starving, vulnerable people will shame Johnson's government, and the voters will send him packing. https://www.huffingtonpost.co.uk/entry/food-charities-demand-no-deal-brexit-cash-grants-to-stop-children-going-hungry_uk_5d3f48eee4b0db8affac9ae6 …",leave
254,07,Tom Watson,"Output down a fifth, investment frozen, 100s of millions being wasted on Brexit prep. Johnson's no deal madness will cripple our car industry. Yet economic sanity is crushed by his self-interested vanity project. Britain deserves so much better.
 https://www.eveningexpress.co.uk/motoring/car-production-down-by-more-than-a-fifth-amid-brexit-fears …",leave
255,07,Tom Watson,"Another day, another fine by the Gambling Commission. This game of cat-and-mouse can’t go on. That is why back in May, I called for a full review of all remote licenses. We need to get a proper hold on what is happening in the British market. https://www.bbc.com/news/business-49175515 …",irrelevant
256,07,Tom Watson,Fella in the red hat. Is it real? https://twitter.com/MusicNegrito/status/1156417787427991552 …,irrelevant
257,07,Tom Watson,George Galloway stands for division and hate. He seeks to silence me by standing in West Bromwich East in the GE. But I won’t be cowed. I would be truly grateful if you could help fund my campaign and say no to the politics of hate. https://www.gofundme.com/f/tom-watson ,leave
258,07,Tom Watson,"I’ve just voted for @KatieCurtis and @judibilling for Labour’s Conference Arrangements Committee. If you support pluralism in the Labour Party, I hope you will consider giving them your support as well.",leave
259,07,Tom Watson,A lovely start to my day. https://twitter.com/firstshowing/status/1147214740852289536 …,irrelevant
260,07,Tom Watson,I love this initiative. https://twitter.com/GrahamAllenMPX/status/1155915745454436353 …,leave
261,07,Tom Watson,"Boris Johnson is desperate to claim some credit for the London 2012 Olympics, but it is clear that his party has damaged and done a great disservice to their legacy. https://www.independent.co.uk/news/uk/politics/tory-party-london-olympics-sport-school-sixth-form-pe-exercise-a9023766.html …",leave
262,07,Tom Watson,"The nation needs to know that Labour stands completely, unequivocally against the Johnson Tory Brexit and will do everything in our power to stop it. With a clear pledge to Remain and Transform Labour can and will kick the Tories out once and for all. https://www.tom-watson.com/stopping_the_boris_johnson_brexit …",leave
263,07,Tom Watson,Russian-state funded RT has repeatedly mocked UK broadcasting impartiality rules. This Ofcom fine is right and appropriate. The regulator needs to make clear that Kremlin-sponsored propaganda has no place here. https://www.independent.co.uk/arts-entertainment/tv/news/rt-russia-ofcom-fine-skripal-poisoning-salisbury-novichok-syria-a9021871.html …,leave
264,07,Tom Watson,What??!! https://twitter.com/CommonsCMS/status/1154340242310213633 …,leave
265,07,Tom Watson,Under Boris Johnson we are hurtling ever faster to a disastrous no deal Brexit. It’s more important than ever that Labour seizes the moment and campaigns unequivocally and proudly for Remain. It’s who we are. Sign here if you agree: https://labourremain.org/ ,leave
266,07,Tom Watson,These young people inspire me. Do try to help them if you can. They have a busy summer ahead. https://twitter.com/OFOCBrexit/status/1154336696265297920 …,stay
267,07,Tom Watson,Oh wow Dave. I’m so in! https://twitter.com/bulletproofexec/status/1154209818493816833 …,leave
268,07,Tom Watson,Worth noting. https://twitter.com/rowlsmanthorpe/status/1154153775541751810 …,irrelevant
269,07,Tom Watson,I’d like to welcome @NickyMorgan01 to her new role. She’s the fourth Secretary of State that I’ll shadow at DCMS. Best wishes to @DCMS_SecOfState (Jeremy Wright). https://twitter.com/NickyMorgan01/status/1154121102710444034 …,irrelevant
270,07,Tom Watson,"Rutger Hauer, who has died aged 75, was an actor of mesmerising ferocity. His performance as murderous replicant Roy Batty in Blade Runner both menacing and hypnotic. He didn't so much light up a screen, as make it glare. RIP Rutger. https://variety.com/2019/film/news/rutger-hauer-dead-dies-blade-runner-co-star-1203278050/ …",stay
271,07,Tom Watson,"I mean, it wouldn’t happen here.... https://twitter.com/DNCWarRoom/status/1154107400535908354 …",stay
272,07,Tom Watson,"This huge cull will lead to early collapse of Johnson's govt bringing GE that much closer.

❌ Mordaunt 
❌ Fox 
❌ Hunt
❌ Clark 
❌ Grayling 
❌ Hinds
❌ Brokenshire
❌ Bradley
❌ Stewart 
❌ Lidington 
❌ Hammond 
❌ Gauke
❌ Mundell
❌ Wright 
❌ Stride
❌ Noakes
❌ Perry",irrelevant
273,07,Tom Watson,"Grand Theft Auto now has a casino which allows players to wager real money for in-game currency. This blatant blurring of the line between gaming & gambling, without the necessary regulation, is of serious concern. https://www.bbc.co.uk/news/technology-49084726 …",stay
274,07,Tom Watson,"Theresa May departing Westminster for the last time as Prime Minister - a long, slow ride down the Mall beckons before it all comes to an end. pic.twitter.com/Zv15nwjVht",leave
275,07,Tom Watson,I strongly welcome the US data monopolies probe. But it hugely frustrates that the Tory govt has failed to do the same here. The incoming PM should challenge these giant vested interests - who extract billions by abusing our personal data - as a priority. http://www.bbc.co.uk/news/business-49089889 …,leave
276,07,Tom Watson,Sadly an accurate assessment from Jonathan here. https://twitter.com/JonAshworth/status/1153697614342348800 …,no sentiment
277,07,Tom Watson,Looking forward to #Farm24 this year. It’s our chance to thank our farmers for the work they do. Farmers should be centre stage in government policy. They can improve the health of the nation and will be central to measures that address climate change. pic.twitter.com/WHgr8g9oQg,leave
278,07,Tom Watson,That’s a neigh neigh to Johnson from a horse whisperer. https://twitter.com/RoryStewartUK/status/1153640542812721154 …,irrelevant
279,07,Tom Watson,"Boris Johnson's election should be the rallying cry for people who believe in our great country to speak out louder than ever against those who would sacrifice our economy, partnerships, and global reputation to foster personal ambition and preservation of their political class.",leave
280,07,Tom Watson,"Deeply disappointing that @MattHancock, who repeatedly vowed to deal with the public health crisis by tackling smoking, sugary drinks and poor diets, has buckled even before the announcement of his new leader. I had presumed he was made of sterner stuff. http://www.theguardian.com/society/2019/jul/23/health-secretary-buries-paper-smoking-obesity-johnson?CMP=Share_AndroidApp_WhatsApp …",irrelevant
281,07,Tom Watson,Very many congratulations.,stay
282,07,Tom Watson,Congratulations @joswinson on becoming the leader of the Liberal Democrats. I hope we can work together to stop a disastrous no deal Brexit.,leave
283,07,Tom Watson,"Just 4% of the UK has access to full fibre. Yet today's review of Huawei's involvement in 5G is a muddle, leaving our digital infrastructure hostage to transatlantic geopolitics. We need a trustworthy and modern 5G network. I fear that under the incoming PM we'll get neither. pic.twitter.com/j1yjfgoqn5",leave
284,07,Tom Watson,How lovely. ❤️ https://twitter.com/CPJElmore/status/1152844651679948800 …,irrelevant
285,07,Tom Watson,"Steve Bray, the Remain campaigner at Westminster is actually a good dancer. https://twitter.com/snb19692/status/1152619769545273349 …",leave
286,07,Tom Watson,Hah! That’s definitely your department.,no sentiment
287,07,Tom Watson,You and your family are in my thoughts and prayers Peter.,stay
288,07,Tom Watson,Thank you. The first step and all that...,stay
289,07,Tom Watson,This misdirected mob justice degrades our great party. These attempts to silence dissent will fail. This is not the party I know. https://www.theguardian.com/politics/2019/jul/20/hilary-armstrong-ex-chief-whip-expel-labour-party …,leave
290,07,Tom Watson,That’s a formidable team you have there. Bravo.,leave
291,07,Tom Watson,It’s a pleasure to see these numbers. Do you monitor your sleep yet?,no sentiment
292,07,Tom Watson,We did it! After 3 and 1/2 hours and a long 9 miles we've completed Challenge 2 of my #Adventures4Health. Canoeing along Black Country canals into the heart of Birmingham. Thanks to @BritishCanoeing @OIA_UK @CanalRiverTrust @_ukactive for all the support. pic.twitter.com/xYT3f9dsyw,leave
293,07,Tom Watson,"Contrary to popular belief, I still have a paddle. 😂",stay
294,07,Tom Watson,Canoeing the canals of the Black Country: Challenge 2 of my #Adventures4Health with  @britishcanoeing @OIA and @ukactive @crtwestmidlands pic.twitter.com/a1GLq1vJqC,no sentiment
295,07,Tom Watson,"The time for warm words is over. Either the gambling industry is going to act in good faith, or we will need stricter regulation of gambling advertising – starting with a ban on football shirt sponsorship. https://www.theguardian.com/football/2019/jul/19/half-of-premier-league-clubs-to-have-gambling-sponsors-for-201920 …",irrelevant
296,07,Tom Watson,2/ Any move to seize a British tanker would be a significant and harmful escalation of a situation where de-escalation is needed.,leave
297,07,Tom Watson,These reports are a matter of real concern.  We know that some days ago there was an attempt to steer a British tanker towards Iranian waters.   Our ships have the right of safe passage and the Stena Impero must be allowed to continue its voyage unimpeded. 1/ https://twitter.com/SamCoatesSky/status/1152287345401614336 …,leave
298,07,Tom Watson,"So many thoughts and emotions here. Gloria is an exceptionally gifted individual, a powerful community advocate, a working class success story and close friend. She is a huge loss to Labour but I fully understand and respect her decision. https://twitter.com/GloriaDePiero/status/1152274103132463104 …",leave
299,07,Tom Watson,"Along the way we are raising money for some great causes: JK Rowling's @lumos charity, @cftrust @WBAFoundation and @SpecialEffect. If you would like to contribute please do below, and, if you have already done so, many thanks again. https://uk.virginmoneygiving.com/fundraiser-display/showROFundraiserPage?userUrl=TomWatsonMP&pageUrl=1 …",irrelevant
300,07,Tom Watson,Challenge 1 was Snowdon. Tomorrow I set off on Challenge 2 of my #Adventures4Health -  canoeing 9 miles of Black Country canals - to promote healthier lifestyles and outdoor activities. Thanks to the fantastic @OIA and @BritishCanoeing for their support. http://www.tom-watson.com/canoeing ,irrelevant
301,07,Tom Watson,"Economists predict axing free TV licences could cost the govt £1.6bn, double the BBC's saving. They call it an ""unintended consequence"". I call it the price you pay for putting TV execs in charge of welfare, and breaking a promise to the most in need. https://www.mirror.co.uk/news/politics/bbc-over-75s-licence-fee-18335538#ICID=Android_TMNewsApp_AppShare …",leave
302,07,Tom Watson,"Last night I had the privilege of introducing national treasure @LennyHenry at the @UKLabour creative industries event. Sir Lenny had a message for the PM: Diversity in film and TV is not a pipeline problem, it's an opportunity problem. The great man speaks much sense. pic.twitter.com/Xvo5buNFGK",leave
303,07,Tom Watson,Brilliant to hear @LennyHenry tonight @UKLabour Creative Industries event making the powerful case for tax reliefs in the creative sector to reward diversity. Thanks to @TileyardLondon for hosting an inspiring evening. pic.twitter.com/caQLYZoROh,irrelevant
304,07,Tom Watson,"Next, it’s time for a full review of the events listed and for Government to put an end to cutting grassroots sports facilities.",no sentiment
305,07,Tom Watson,"These events attract TV audiences in their millions and showcase the very best of British sporting talent. They should be awarded the status, protection, and recognition they deserve.",leave
306,07,Tom Watson,Once again Labour has led the way on this and the government has followed. They’ve heeded our call for women’s sports and the Paralympics to be added to the list of crown jewel sporting events to be broadcast free to air. http://www.bbc.co.uk/sport/49026535 ,leave
307,07,Tom Watson,"The knock on the door over a £154.50 debt will be devastating for over 75s denied their free TV licence. Whether a BBC ""Outreach"" worker or an enforcement official, the impact will be just as disturbing. Shame on the Tories, breaking a manifesto pledge. https://www.shropshirestar.com/news/uk-news/2019/07/18/over-75s-to-be-visited-by-bbc-outreach-teams-over-tv-licence-payments/ …",leave
308,07,Tom Watson,Ancient woodlands now cover just 2% of our land. To put brown bears and grey wolves back in those habitats for the first time in over 1000 years is a stimulating rewilding initiative for both the wildlife and our precious woods. https://www.theguardian.com/uk-news/2019/jul/16/bears-and-wolves-to-coexist-in-uk-woods-in-conservation-project?CMP=Share_AndroidApp_Copy_to_clipboard …,irrelevant
309,07,Tom Watson,"Let's get this straight. The no deal position is that we should slaughter all our sheep, and then pay farmers 100s of £ms for the privilege. What next? Get all our car makers to burn all their vehicles. Genius. pic.twitter.com/tJyiClFBVX",leave
310,07,Tom Watson,"News of @FreeNazanin's transfer to a psychiatric ward is deeply disturbing. My thoughts are with Nazanin, husband Richard and the family. I urge Iran to release her as a matter of humanity. The new PM must make Nazanin's freedom a personal priority. https://www.bbc.co.uk/news/uk-49006915 …",leave
311,07,Tom Watson,"Happy significant birthday to my parliamentary colleague,@EmmaHardyMP.",irrelevant
312,07,Tom Watson,"When you turn 100 years old you get a letter from The Queen. But from next year, our analysis shows, over 11,000 centenarians will also get letters demanding payment for a TV licence. It’s nothing short of a scandal. https://www.mirror.co.uk/news/politics/101-year-olds-moving-letter-18326213#ICID=Android_TMNewsApp_AppShare …",irrelevant
313,07,Tom Watson,The malevolence in her words and tone is chilling. https://twitter.com/MSNBC/status/1151181198745636867 …,irrelevant
314,07,Tom Watson,Now is the time for Parliamentarians of all stripes to heed this warning and to tell Johnson and Hunt that we won’t let them sink our economy to save their political skins.,leave
315,07,Tom Watson,The pound is falling because both of the contenders for Tory Leader are committed to a No Deal Brexit - the currency markets are giving us a taste of what to expect if they are allowed to pursue such a policy of extreme economic self harm.,stay
316,07,Tom Watson,The Conservative Party has moved from advocating trickle down economics to causing tumble down economics instead. https://www.theguardian.com/business/live/2019/jul/16/markets-uk-unemployment-wages-ryanair-boeing-737-max-mark-carney-business-live?CMP=Share_AndroidApp_WhatsApp …,leave
