,date,name,tweet,stance
0,11,Tom Watson,Blimey. I’ve never seen that. Was that 2015?,no sentiment
1,11,Tom Watson,Impressive news that @UK_Music has now revealed that music contributes £5.2 billion to the economy. I am backing music during this election campaign and want to ensure that we take steps to grow these impressive figures further #MusicByNumbers https://twitter.com/uk_music/status/1197031821202149377 …,leave
2,11,Tom Watson,"well, yes, I guess you're right Audrey.  The data generated has transformed my organisation around sleep and exercise is what I should have said.",no sentiment
3,11,Tom Watson,I consider the @Ouraring to be the most powerful wearable diagnostic device on the market. It has transformed my sleep and helped me understand when and when not to exercise. See how you can win an Oura smart ring here:   http://bit.ly/32Vn1sy  pic.twitter.com/c97MRIUK7H,leave
4,11,Tom Watson,Three fabulous days of learning to be a Level 2 gym instructor. I can’t recommend @FutureFit_UK more highly. pic.twitter.com/pXPdCCMVYX,irrelevant
5,11,Tom Watson,stick with me kid!,stay
6,11,Tom Watson,"If you lost your AirPods in a taxi this morning, get in touch, tell me their name and I’ll get them back to you. pic.twitter.com/ygOEG4M7ZS",irrelevant
7,11,Tom Watson,This has made my day and I’ll be following it up! https://twitter.com/davidlloyduk/status/1194985840021266437 …,stay
8,11,Tom Watson,I think you’ll be ok with the book!,stay
9,11,Tom Watson,Thank you!,irrelevant
10,11,Tom Watson,😉,leave
11,11,Tom Watson,Thank you!,irrelevant
12,11,Tom Watson,Yay - my first order. Great man sceeners!,no sentiment
13,11,Tom Watson,"Did I tell you I'm bringing out a book? Downsizing, in all good bookshops from January. 
Amazon:  https://amzn.to/2m9a4eN 
Waterstones:  http://bit.ly/2K9XXY6 
According to clever literary people, pre-orders really help struggling writers. Please can you help me?",no sentiment
14,11,Tom Watson,I have known Ibrahim and his family for many years. He is a very compassionate man who will work very hard for his constituents. His work with homeless people has been inspirational. Very best wishes to him and the team in West Bromwich. https://twitter.com/ibrahim_dogus/status/1193214174345740293 …,leave
15,11,Tom Watson,"After 35 years in full-time politics, I've decided to step down and will be campaigning to overcome the Tory-fuelled public health crisis. I'm as committed to Labour as ever. I will spend this election fighting for brilliant Labour candidates and a better future for our country. pic.twitter.com/qGqiKTJ6br",leave
16,11,Tom Watson,“Now we have proof: the government used your money to lie about poor people” @chakrabortty in the @guardian https://www.theguardian.com/commentisfree/2019/nov/06/government-universal-credit-deception-asa-taxpayer-funded-features …,leave
17,11,Tom Watson,"A moving portrait of the late Scott Hutchison by @ChrisHawkinsUK, who concludes that one of Scott’s legacies is a repertoire of “hymns to the possibilities of change”. Beautiful. https://www.bbc.co.uk/sounds/play/m0009zby …",irrelevant
18,11,Tom Watson,"The Tory decision to scrap free TV licences for over-75s is utterly callous. From next year 3.7 million older people will lose their free TV licence.
It’s disgraceful. Our message is clear - vote Labour to save free TV licences. https://www.mirror.co.uk/news/politics/free-tv-licences-over-75s-20803772 …",leave
19,11,Tom Watson,We’ll save free TV licences. https://twitter.com/AllieHBNews/status/1191122516024143877 …,leave
20,11,Tom Watson,This is completely disgraceful from Instagram. Amelia's family should have their privacy and wishes respected at this tragic time. Instagram's community standards are clearly morally redundant. Labour will introduce the tech regulator we urgently need. https://www.mirror.co.uk/news/uk-news/family-tragic-backpacker-amelia-bambridge-20796949 …,leave
21,11,Tom Watson,The Tories promised in their last manifesto to keep free TV licences for over-75s but they have completely refused to fund them. Now 3.7 million older people face losing out. In Sept' I met with some veterans of the British Legion - and they are not happy with this broken pledge. pic.twitter.com/Wv2lXAbMvj,leave
22,11,Tom Watson,10. This application is a disgrace. The fundamental question of why a company run by an associate of Boris Johnson was ever given this grant remains unanswered. The public deserve to know why their money was spent so irresponsibly. We will not let this lie.,leave
23,11,Tom Watson,"9. Then there’s this little note at the end.
@HackerHouseUK, if you’re still wondering: No, you’re not. pic.twitter.com/HSPujyR6Sn",irrelevant
24,11,Tom Watson,"8. But apparently that’s ok, because once the public have paid to get the company off the ground, they’ll finally make a profit. pic.twitter.com/ASoumpTFAB",leave
25,11,Tom Watson,7. And that there isn’t any wriggle room pic.twitter.com/S8dmId35e4,irrelevant
26,11,Tom Watson,6. It is made completely clear that the taxpayer’s money she wants is to pay her staff pic.twitter.com/h1Yj6JYmJc,leave
27,11,Tom Watson,5. And they're not wrong about the lack of cash: pic.twitter.com/Uue78IStY1,leave
28,11,Tom Watson,4. The only reason they’re not already the Netflix of security is because they don’t have the money: pic.twitter.com/EDDsaYHaQU,leave
29,11,Tom Watson,3. And she believes her personal charisma is key: pic.twitter.com/c7THFGh0U0,leave
30,11,Tom Watson,2. Jennifer Arcuri claims she wants to set up “the Netflix of security” and that she needs 100k of public money to do it. pic.twitter.com/OcOK0MPftO,irrelevant
31,11,Tom Watson,"1. The Hacker House saga continues – DCMS’ ‘review’ of the grant award is a whitewash. 
No one reading Hacker House’s grant application would give the company a penny, let alone £100,000 of tax payers’ money. 
Let’s take a look…",no sentiment
32,10,Tom Watson,"This is not a business deal, it’s a data grab. This would give Google highly sensitive personal health data on millions of people, and that should worry us all. The CMA should halt and investigate this merger immediately. https://www.theguardian.com/technology/2019/oct/29/labour-calls-for-halt-to-googles-acquisition-of-fitbit …",irrelevant
33,10,Tom Watson,"This Government’s plan to introduce voter ID is a blatant attempt to stop poorer people, minorities and the elderly from voting. There is no compelling evidence that polling station fraud is an issue. We cannot let the Tories shut down our democracy. https://www.expressandstar.com/news/politics/2019/10/29/watson-fury-over-voter-id-plan/ …",leave
34,10,Tom Watson,Great to see the @RegistHERtoVote campaign encouraging women to register to vote. They need our help to reach and support women who might otherwise struggle to claim their right to vote. https://twitter.com/RegistHERtoVote/status/1188866146298204160 …,irrelevant
35,10,Tom Watson,"Happy Bandi Chhor Divas and happy Diwali to everyone celebrating today. This is a time for families to come together, pray and light candles, spreading the message that hope and light overcome darkness.",leave
36,10,Tom Watson,This is fantastic news. Congratulations to all the families of people living with #cysticfibrosis and the campaigners who have fought so hard to get to this day. #orkambinow https://twitter.com/cftrust/status/1187300611341082625 …,leave
37,10,Tom Watson,"Time and again this Prime Minister resorts to his usual bluster to avoid taking responsibility, but we know the truth. The Tories promised to keep free TV licences but have completely refused to fund them. Now 3.7 million people will miss out. https://www.mirror.co.uk/news/politics/boris-johnson-claimed-would-put-20708806 …",leave
38,10,Tom Watson,"Levels of problem gambling among children remain stubbornly high. One child gambling addict is too many, let alone 55,000. Figures show one in ten children are gambling every week. Labour will tackle this head-on with a comprehensive new gambling act.
 https://www.gamblingcommission.gov.uk/news-action-and-statistics/News/gambling-commission-publishes-the-2019-young-people-and-gambling-report …",leave
39,10,Tom Watson,"Amazon is working its factory staff to the bone, clocking every minute of their time, even toilet breaks. This government has handed Amazon £500m of contracts since 2015. There should be no more contracts until these modern slavery practices are ended. https://www.mirror.co.uk/news/politics/labour-demands-action-against-appalling-20701108 …",leave
40,10,Tom Watson,"I was 14 yrs old - the summer after Thatcher's notorious 1981 budget. 'Ghost Town' spoke to me and every other teenage kid. The message of social neglect and division are as relevant now as they were then. Thanks @UK_Music and @SuperSizeArt for this gift.
 https://www.independent.co.uk/arts-entertainment/music/features/ghost-town-the-song-that-defined-an-era-turns-30-2306003.html … pic.twitter.com/y4hP48Nnt6",irrelevant
41,10,Tom Watson,"Every week, yet another report comes out raising serious questions over loot boxes in video games. It is beyond question now that we need to solve this problem for the long term. That is why Labour has called for an overhaul of our gambling legislation. https://www.theguardian.com/society/2019/oct/22/clamp-down-on-fortnite-loot-boxes-urges-childrens-commissioner …",irrelevant
42,10,Tom Watson,Facebook has taken down 4 accounts linked to Iran and Russia - one of which was targeting the 2020 US election. Will Mark Zuckerberg finally ensure his popular platforms provide an honest and fair playing field. Or will he just take the money? https://www.theguardian.com/technology/2019/oct/21/facebook-us-2020-elections-foreign-interference-russia …,leave
43,10,Tom Watson,Thank you. 🙏🏻,irrelevant
44,10,Tom Watson,"Universal Credit is clearly failing. It has led to a huge rise in food bank use, poverty, and distress and pushed countless disabled people into destitution. @UKLabour will scrap it. We need a system that treats everyone with dignity and respect. #ScrapUniversalCredit pic.twitter.com/7xrl6RVcKZ",leave
45,10,Tom Watson,"Disgraceful. Amazon should put an end to these outrageous practices immediately. If they don't, the next Labour Government will. https://www.mirror.co.uk/news/uk-news/amazon-warehouse-staff-treated-like-20661995 …",leave
46,10,Tom Watson,"The last few years of politics have been hard but we will have to live with the consequences of this deal for years, maybe decades to come. Wanting the difficult topic of Brexit to be ‘over’ is not a reason to vote for a hard Brexit deal that will damage our country.",leave
47,10,Tom Watson,Johnson must comply with the law. His deal will make us poorer and degrade environmental and workers’ rights. He cannot force this through by threatening a disastrous No Deal. The only way to finally and fairly resolve this and bring the country together is through a #PeoplesVote,irrelevant
48,10,Tom Watson,The Government’s much vaunted Age Verification policy is dead. Will the badly needed online harms legislation also be delayed? We must not let this happen. We need to take on the tech giants. We need to keep our kids safe. My question to the Minister... pic.twitter.com/XvcaKkIFNY,leave
49,10,Tom Watson,1.7 million older people will see a fall in living standards when they lose their free TV licence next year. This Government should search its conscience and save free TV licences today. https://www.mirror.co.uk/news/politics/boris-johnson-could-face-crunch-20633949 …,leave
50,10,Tom Watson,"Please wish a happy birthday to Parliament’s musical maestro, the great @KevinBrennanMP",stay
51,10,Tom Watson,Congratulations to @BernadineEvari for making history by winning the #BookerPrize for #GirlWomanOther. Add it to your reading lists. https://www.theguardian.com/books/2019/oct/14/booker-prize-judges-break-the-rules-and-insist-on-joint-winners …,irrelevant
52,10,Tom Watson,Today the Government had a chance to save free TV licences and right this wrong for older people – but they didn’t. Millions of older people are set to lose out next year because of this broken Tory manifesto promise. https://www.mirror.co.uk/news/politics/boris-johnson-under-pressure-save-20562275 …,leave
53,10,Tom Watson,"It's a national scandal that 552,000 older people living with dementia could have their free TV licences scrapped next year - despite a Tory manifesto promise. It's a tragedy in the making for some of the most vulnerable people in our communities. https://www.theguardian.com/media/2019/oct/13/half-a-million-over-75s-with-dementia-will-have-to-pay-for-tv-licences-study …",leave
54,10,Tom Watson,That’s ace!,no sentiment
55,10,Tom Watson,Labour’s general election “secret weapon” addresses the thorny issue of message discipline. https://twitter.com/FromSteveHowell/status/1183386643862036480 …,leave
56,10,Tom Watson,Including Rebecca.,no sentiment
57,10,Tom Watson,"Thank you to all the gurdwaras in the Sandwell Sikh community for jointly organising this wonderful event to celebrate the #550YearsOfGuruNanakDevJi, and honouring me as their guest. pic.twitter.com/Nabkuli9bj",irrelevant
58,10,Tom Watson,A momentous day in sport. https://twitter.com/INEOS159/status/1182933612162945024 …,irrelevant
59,10,Tom Watson,"The Government must save free TV licences in Monday's Queen's Speech. If they don't, millions of the oldest people in our society will have to choose between being worse off or being cut off from the wider world.
 https://www.mirror.co.uk/news/politics/boris-johnson-under-pressure-save-20562275 …",leave
60,10,Tom Watson,The National Lottery generates billions for good causes. But communities should get back what they put in through ticket sales. Labour will make the lottery fairer and more democratic. https://www.mirror.co.uk/news/politics/lottery-money-should-go-many-20559062 …,leave
61,10,Tom Watson,"When even children are telling us that they are gambling to the point of distraction, addiction and even thoughts of suicide, we know that we have a crisis on our hands. That's why the Labour Party has pledged to sort out this problem - once and for all. https://www.bbc.co.uk/programmes/p07qcl65 …",leave
62,10,Tom Watson,The Tory government should never have foisted the responsibility for funding free TV licences onto the BBC in the first place. It was an act of political cowardice and now 3.7 million older people are set to lose out next year. https://www.mirror.co.uk/news/politics/mps-urge-bbc-ministers-cut-20555015 …,leave
63,10,Tom Watson,The UK’s industrial towns and coalfield communities buy a bulk of lottery tickets but feel that they don’t get their fair share of money for good causes. Today we are committing to making the lottery fairer and more transparent. https://www.mirror.co.uk/news/politics/labour-promises-give-more-lottery-20556103 …,leave
64,10,Tom Watson,Our children are suffering from an obesity crisis fuelled by junk food companies. Yet this government refuses to act. We cannot go on like this. https://www.theguardian.com/society/2019/oct/10/severe-obesity-among-children-aged-10-to-11-record-high-england …,leave
65,10,Tom Watson,I’d love to. It would be a genuine pleasure.,stay
66,10,Tom Watson,The #StirlingPrize for @NorwichCC is great news. But as dep leader Gail Harris says: “That's not the point. It’s about people having good quality homes and low fuel bills. We plan to build a lot more.” That's local Labour govt delivering for the community. https://www.theguardian.com/artanddesign/2019/oct/08/stirling-prize-architecture-goldsmith-street-norwich-council-houses …,leave
67,10,Tom Watson,"On Saturday October 19th, millions will attend the #PeoplesVoteMarch in London. The same day, parliament will hold a special sitting on Brexit. I assure you the call to give the people a final say will be stronger, louder and clearer than ever. https://www.bbc.co.uk/news/uk-politics-49984367 …",no sentiment
68,10,Tom Watson,"Saying ""sorry"" and they've corrected the ""error"" isn't good enough. Twitter must offer a full explanation. How many people affected? How long has this security breach gone on? Yet again, the tech giants have played fast and loose with our personal info. https://www.bbc.co.uk/news/technology-49981981 …",leave
69,10,Tom Watson,"I’m the shadow Secretary of State for Digital, Culture, Media and Sport.",no sentiment
70,10,Tom Watson,"Former GCHQ chief David Omand says the uncontrollable social media giants know more than any spy agency ""could or should know about us,"" adding they pose ""a major threat to democracy"". 

And precisely why it's time to regulate the global tech monopolists. https://www.theguardian.com/uk-news/2019/oct/08/tech-firms-know-more-about-us-than-any-spy-agency-ex-gchq-chief …",leave
71,10,Tom Watson,Here's the full report: https://leadersinsport.com/sport-business/leaders-special-report-beoutq-an-unprecedented-piracy-story/ …,irrelevant
72,10,Tom Watson,This industrial scale piracy is damaging to TV companies and sports industries. It must stop. https://www.theguardian.com/football/2019/oct/08/premier-league-clubs-tv-rights-piracy …,irrelevant
73,10,Tom Watson,I wish everyone observing #YomKippur a meaningful and peaceful fast. #GmarChatimahTova.,no sentiment
74,10,Tom Watson,"This is what the blame game looks like: cynical, anonymised briefings which put party before country, and smear European allies. It only serves Boris Johnson’s political ambition as he throws the UK under the no deal bus. We cannot allow this to happen. https://www.theguardian.com/politics/2019/oct/08/boris-johnson-ready-to-give-up-on-brexit-deal …",leave
75,10,Tom Watson,"Today, while discussing my personal health journey, I've been highlighting the grave threat that Boris Johnson's no deal poses to UK agriculture and the food supply, including fruit & veg, through tariffs, labour shortages, and lower health and environmental standards. #FPJLIVE pic.twitter.com/9UCwMm99Oq",leave
76,10,Tom Watson,"Born in Yorkshire, pride of the Black Country. Happy 90th birthday Betty Boothroyd. https://www.yorkshirepost.co.uk/news/politics/betty-boothroyd-at-90-former-pms-sir-john-major-and-tony-blair-lead-tributes-to-pioneering-speaker-and-national-treasure-1-10038797 …",leave
77,10,Tom Watson,"We are also committed to safe standing in stadiums, ensuring the richer clubs pay a fair share into grassroots football, making the Women's World Cup Final a crown jewel event, introducing a travel fare scheme for fans and improving access for supporters with disabilities.",leave
78,10,Tom Watson,"Today we are announcing our plans to put football fans at the heart of the game, by legislating to allow supporters to buy shares in their clubs and make appointments to directors's boards. https://news.sky.com/story/labour-vow-to-give-football-fans-power-to-hire-and-fire-club-directors-11829352 …",irrelevant
79,10,Tom Watson,Hiya - I’m completely opposed to it and the campaign to stop it has my full and active support. They’re a disgrace.,leave
80,10,Tom Watson,Amal Clooney's right to raise the banner for press freedom and challenge the inertia of govts and the UN to the rising toll of journalists like Christopher Allen and Jamal Khashoggi killed in line of duty. I hope the UK Govt champions her call for action. https://www.theguardian.com/media/2019/oct/01/amal-clooney-give-un-power-investigate-journalist-deaths-jamal-khashoggi …,leave
81,10,Tom Watson,"Last week the govt said #HackerHouse was a UK company. Since then we've discovered: its UK tel. rings in the US; a director's change of address to the US; and a £700k loan. Today I challenged
@mattwarman on whether this unusual £700k transaction was used to unlock UK Govt funds. pic.twitter.com/fnpXmvUr3c",stay
82,10,Tom Watson,"Christopher Allen's death ""should not be invisible. To let it pass without a rigorous investigation is to sanction the impunity of the killing of journalists."" @GreensladeR rightly making the case for a proper investigation into this young man's killing. https://www.theguardian.com/media/2019/sep/29/why-death-of-war-reporter-christopher-allen-must-be-made-visible …",irrelevant
83,10,Tom Watson,Happy birthday @parkrun. https://twitter.com/parkrun/status/1175288559844110336 …,irrelevant
84,10,Tom Watson,This is the right decision. Calling out racism takes courage. The ruling against Naga Munchetty was wrong and I hope the BBC reviews the process that led to it. https://www.bbc.co.uk/news/entertainment-arts-49883952 …,leave
85,09,Tom Watson,"If we want to take full advantage of the fourth industrial revolution, we need far more than this Government’s half measures.",leave
86,09,Tom Watson,"Connectivity will underpin the jobs and economy of the future, but today the UK’s digital infrastructure is lagging embarrassingly behind. This Tory Government cannot just paper over the cracks.",leave
87,09,Tom Watson,"At a time when the UK is falling behind in the digital race and hundreds of thousands of premises don’t even have access to decent broadband, this Government announcement falls far short of the ambition we need. https://www.itpro.co.uk/network-internet/34523/too-many-hurdles-for-2025-full-fibre-pledge-despite-fresh-5bn-injection …",leave
88,09,Tom Watson,"I send my best wishes to all in the Jewish community for a sweet and joyous #RoshHashanah . 

I hope the coming year will bring health and happiness and a renewal and celebration of the role British Jews take in society.

L’Shana Tova pic.twitter.com/kK9lZPWMLy",irrelevant
89,09,Tom Watson,"Our nuclear test veterans deserve so much better than this. If rigorous scientific study proves British soldiers were harmed by our nuclear weapons tests, the MoD should recognise these vets for their service. http://www.mirror.co.uk/news/uk-news/tories-could-ignore-proof-brit-20331315 …",leave
90,09,Tom Watson,Hope you’re ok Jason.,leave
91,09,Tom Watson,Happy #getoutsideday everyone! I'm celebrating with a woodlands walk in the Wyre Forest. A great way to put aside politics for a few hours and #GetOutside. @OrdnanceSurvey @oia_uk @oiaukceo @osleisure pic.twitter.com/o5He2WAk17,irrelevant
92,09,Tom Watson,"This is a great book for Christmas, particularly if you follow a #keto lifestyle. https://twitter.com/CheeseTastingCo/status/1178250560350367744 …",stay
93,09,Tom Watson,I’ve no doubt Margaret will win a full selection but on the cusp of a general election it will take a lot of energy and time. And then there’s the obvious reaction in the media that will distract from Labour’s positive message for change and cause the party more reputatuonal harm https://twitter.com/ayeshahazarika/status/1177971431273054217 …,leave
94,09,Tom Watson,"Like other MPs, my surgeries are full of people left distraught by the vindictiveness of UC. Ending sanctions, the 5-week wait, the 2-child limit, and the capricious capability for work assessments is doing the right thing by millions of people. https://www.bbc.co.uk/news/uk-politics-49855479 …",leave
95,09,Tom Watson,"The Tories have become a sinister extremist sect, leaving a vacuum where there ought to be a govt. The stakes are higher than they’ve ever been. This is a time to keep our gaze high, remember who we are, what we believe, and what we’re trying to achieve. https://www.tom-watson.com/the_speech_that_never_was …",leave
96,09,Tom Watson,"This morning, 60 days after @JohnnyMercerUK became a minister, @NiaGriffithMP and I wrote to Cab Sec seeking confirmation he had resigned his directorship. It now transpires he stood down today. We need to know if the ministerial code has been breached. https://www.theguardian.com/politics/2019/sep/27/defence-minister-may-have-breached-rules-over-second-job …",leave
97,09,Tom Watson,"I first raised concerns about the DCMS fund that gave money to #HackerHouse in April. It also funded Crucial Academy, which pays @JohnnyMercerUK £85k a year and is linked to corrupt LCF. There are serious Qs about DCMS diligence that need investigating. https://www.theguardian.com/politics/2019/sep/26/state-fund-jennifer-arcuri-row-grant-firm-pays-tory-mp-johnny-mercer …",leave
98,09,Tom Watson,This is such a depressing story. We knew scrapping millions of free TV licences would leave older people worse off and more isolated. Now we know it leaves them vulnerable to despicable fraudsters too. This Tory govt should urgently rethink its decision. https://www.mirror.co.uk/news/politics/pensioners-targeted-tv-licence-scammers-20271315 …,leave
99,09,Tom Watson,"The language used by people in power matters. It takes courage to call it out and it is necessary that we do so. @BBCNaga was asked as a woman of colour for an interpretation of Trump's words. Rightfully, she gave it. The ruling against her is ridiculous. http://www.bbc.co.uk/news/entertainment-arts-49825570 …",irrelevant
100,09,Tom Watson,"I’ve been thinking very deeply about Jo Cox in the last couple of days, not least because I spent time with her sister yesterday. Jo was a future party leader and potential Prime Minister. She could have healed a divided nation and we would have been proud of her.",stay
101,09,Tom Watson,The truth is our prime minister does reckless things. He is a man whose character renders him unfit for the office he holds. http://www.theguardian.com/politics/2019/sep/25/unfit-for-office-mps-challenge-boris-johnson-public-money-jennifer-arcuri …,irrelevant
102,09,Tom Watson,This DCMS fund is specifically designed to promote homegrown U.K. cyber security companies. Why has £100k tax payer’s money been given to a Californian company? #HackerHouse pic.twitter.com/PJeMVw10Xx,leave
