,date,name,tweet,stance
103,09,Tom Watson,"Today I've asked a series of questions about Boris Johnson, a £100k DCMS grant to #HackerHouse, and his connection to that company. These are fundamental questions of character and suitability for high office. I am determined to get the answers. #Parliament pic.twitter.com/btYR3vVPQC",irrelevant
104,09,Tom Watson,I loved this man. https://twitter.com/UKLabour/status/1176828699141820416 …,leave
105,09,Tom Watson,My office just rang this ‘UK number’ for Hacker House.  A woman in California picked up. https://twitter.com/BrianUkulele/status/1176838581190627333 …,stay
106,09,Tom Watson,Thank you so much for an early morning boost. Your team were great.,stay
107,09,Tom Watson,"Absolutely delighted to join Kim Leadbeater from @JoCoxFoundation and Brighton's Deputy Mayor Alan Robins to celebrate @FitnessDayUK. Kim's got arthritis, I've had T2 diabetes and Alan's had a heart attack. If we can do it, so can anyone. @_ukactive pic.twitter.com/P664z9E24D",leave
108,09,Tom Watson,We must remain positive in all storms dear Michael.,stay
109,09,Tom Watson,Thanks Brighton for a fun week. https://twitter.com/dan_bewley/status/1176563204840939520 …,stay
110,09,Tom Watson,It’s right that Jeremy’s speech has been moved to this afternoon. I will be with all Labour colleagues in Parliament tomorrow. I’ll have to save the speech until the next conference.,no sentiment
111,09,Tom Watson,Boris Johnson should resign. https://twitter.com/bbclaurak/status/1176431746411356160 …,irrelevant
112,09,Tom Watson,"The Tories under Boris Johnson seem to want to destroy not just our economy and our social fabric, but our constitution too. Labour must be together. This is a time to keep our gaze high. http://www.mirror.co.uk/news/politics/tom-watson-accuse-boris-johnson-20160384 …",stay
113,09,Tom Watson,"This is dreadful for 9,000 staff, and 150k Brits abroad. Why did RBS turn its back on a £200m bail-out, leaving taxpayers a £600m repatriation/compensation bill?  And why didn't Govt intervene? 
If only we had a Parliament to hold ministers to account... http://www.theguardian.com/business/live/2019/sep/23/thomas-cook-travel-chaos-insolvency-leaves-150000-stranded-on-holidays-live-updates …",irrelevant
114,09,Tom Watson,Irony is not dead. https://twitter.com/jonlansman/status/1176061846656360448 …,stay
115,09,Tom Watson,Important to take a moment to mark the 70th birthday of Bruce Springsteen. Thanks for the good times. https://www.nybooks.com/daily/2019/09/21/springsteen-at-seventy/ …,leave
116,09,Tom Watson,"I'm delighted that @EmilyThornberry will today announce Labour's pledge of compensation for our nuclear test vets. It provides long overdue recognition
of their service to our country and we'll continue to campaign for the vets to be honoured with a medal. http://mirror.co.uk/news/politics/justice-nuclear-test-veterans-labour-20147174 …",leave
117,09,Tom Watson,Hello Brighton! It's lovely to be here. #Lab19 https://twitter.com/ElunedAnderson/status/1175467163655843845 …,irrelevant
118,09,Tom Watson,I used to love Bayonetta. That was a class game. Lousy character on super smash bros though.,leave
119,09,Tom Watson,"When Boris Johnson raged against the sugar tax, he called it a ""sin tax"" and wanted ""evidence"" of its worth. Now we have it:

Tax on soft drinks = 28.8% FALL in sugar consumed. 

No tax on cakes and biscuits = 2.6% RISE in sugar consumed.

The case rests. http://www.theguardian.com/society/2019/sep/20/britons-consuming-more-sugar-despite-tax-and-anti-obesity-drive …",leave
120,09,Tom Watson,"With trees acting as vital carbon sinks for the planet, 
@JonAshworth's ""NHS forest"" is critical to the delivery of a truly green health system. We need a green reboot of all sectors of our economy to tackle the climate emergency - starting right now. http://www.theguardian.com/society/2019/sep/19/labour-plans-nhs-forest-of-a-million-trees-at-hospitals …",leave
121,09,Tom Watson,"It is inconceivable that the national executive committee of the Labour Party would allow a Labour candidate to run against an incumbent Speaker, even with the current make up of the NEC! https://twitter.com/ESTheLondoner/status/1174994013193216000 …",leave
122,09,Tom Watson,I hadn’t. Thank you for bringing it to my attention.,stay
123,09,Tom Watson,Thank you and thanks also for all the work members are doing to support parliamentary colleagues.,stay
124,09,Tom Watson,The fresh herrings point is well made.,no sentiment
125,09,Tom Watson,"I note @NickyMorgan01's speech re: women's sports on TV, and welcome her to the roll call of DCMS Secretaries adopting Labour policies.

I would now like to refer her, as an urgent matter, to Labour's pledge to end betting sponsorship on football shirts. https://www.thedrum.com/news/2019/09/18/government-wants-broadcast-parity-between-major-men-and-women-s-sports …",irrelevant
126,09,Tom Watson,"The credibility of any industry depends on integrity and trust. In the gambling industry, this is in short supply. Incentivising customers through sham free bets is bad enough - when coupled with encouraging false 5-star reviews, all credibility is lost. http://www.thetimes.co.uk/article/betway-gives-away-free-bets-in-exchange-for-reviews-on-trustpilot-008k6ts8h …",irrelevant
127,09,Tom Watson,This is a thoughtful and insightful talk about the causes and remedies of anxiety and depression. https://twitter.com/johannhari101/status/1174339018277957633 …,leave
128,09,Tom Watson,"This is why we need a national banking system based around our post offices - supporting their viability in communities, and ensuring millions of poorer families have access to banks and cashpoints. No one should be left behind by digital transformation. http://www.bbc.co.uk/news/business-49730367 …",leave
129,09,Tom Watson,Here John... http://www.belfasttelegraph.co.uk/sport/cricket/labour-deputy-makes-freetoair-cricket-pledge-as-8-3m-watch-world-cup-final-38313939.html …,irrelevant
130,09,Tom Watson,"I look forward to hearing @NickyMorgan01 making a significant policy announcement today on televising women's sport events. Like her predecessors at DCMS, she may find it useful to get a few tips from Labour... http://www.independent.co.uk/sport/football/womens_football/womens-world-cup-2019-labour-tom-watson-tv-free-to-air-broadcast-sky-sports-events-a8955376.html …",irrelevant
131,09,Tom Watson,"Jon has forgiven Salma Yaqoob for standing against the Labour Party in elections, the last time two years after Jeremy Corbyn was elected leader. Sadly, he can’t forgive @LabourStudents and their campaigns for Labour victories over several decades. So he has had them abolished. https://twitter.com/jonlansman/status/1173931485629493248 …",leave
132,09,Tom Watson,This distressing article sheds light on Facebook's dystopian underbelly. The tech giant's response symbolises a company that long lost its moral compass. I wonder what the young Mark Zuckerberg would make of the creation of his older self. https://www.theguardian.com/technology/2019/sep/17/revealed-catastrophic-effects-working-facebook-moderator …,leave
133,09,Tom Watson,May I introduce you to the Incredible Hulk. Today he is wearing his Harry Potter invisibility cloak... pic.twitter.com/EyRaSsZFRB,irrelevant
134,09,Tom Watson,Hulk smash. https://twitter.com/MarkRuffalo/status/1173273612075376641 …,stay
135,09,Tom Watson,"When 80k people die every year through smoking, what type of Government pushes cheap cigarettes onto the public, in breach of its own advertising rules? This is a new low from ministers desperate to justify their obsession with a risky no deal Brexit. https://www.mirror.co.uk/news/politics/sajid-javid-reported-advertising-watchdog-20061024 …",leave
136,09,Tom Watson,Solidarity Jack. I’m sure @sterling7 will be proud of you for speaking out. https://twitter.com/JackFTBL1/status/1172510930137223169 …,irrelevant
137,09,Tom Watson,Election issue. https://twitter.com/HSJEditor/status/1172411660755075074 …,stay
138,09,Tom Watson,How refreshing to see a football shirt warning of problem gambling. Fantastic stuff @LewesFC and @GambleWithLives. Come on you Rooks! https://www.bbc.co.uk/sport/football/49683406 …,irrelevant
139,09,Tom Watson,"Hello @HenleyLitFest! 

Nice to see a Tory minister accepting the verdict of the powers that be rather than just saying he’ll go ahead and do it anyway.

I'm happy to chat if Jacob Rees-Mogg is still laid low. https://twitter.com/Jacob_Rees_Mogg/status/1170080900119445504 …",stay
140,09,Tom Watson,Two years ago I wouldn’t have noticed a mid-morning Mars Bar or Kit Kat. Today it would knock me out.,stay
141,09,Tom Watson,It should have been DCMS Questions in the House this morning. I would have asked the Secretary of State what Dominic Cummings and the PM are profiling our citizens for? https://www.buzzfeed.com/alexspence/boris-johnson-dominic-cummings-voter-data …,no sentiment
142,09,Tom Watson,"I am proud of our British games industry, but we clearly need to sort this out - and fast. Self-regulation is not the answer, but nor is outdated legislation. That is why Labour will introduce a new Gambling Act, to meet the realities of the digital age. https://www.theguardian.com/games/2019/sep/12/video-game-loot-boxes-should-be-classed-as-gambling-says-commons …",leave
143,09,Tom Watson,So.... https://twitter.com/RobertBuckland/status/1171743709148454913 …,irrelevant
144,09,Tom Watson,"The prorogation is illegal. This is the first test of whether Boris Johnson will obey the law: will he let MPs come back to work? He has misled everyone, including the Queen. Surely there must be consequences? https://www.bbc.co.uk/news/uk-scotland-49661855 …",leave
145,09,Tom Watson,Excellent speech from union delegate and military veteran John McDonnell. https://twitter.com/WKennyGMB/status/1171662763338416128 …,leave
146,09,Tom Watson,Thanks Rus. Hope you’re well.,stay
147,09,Tom Watson,"From being an overweight sugar addict to climbing Snowdon, I'm sharing my story in ""Downsizing: How I lost 8 stone, reversed my diabetes and regained my health"". Thanks to @susannareid100 for the inspirational idea. https://www.standard.co.uk/news/londoners-diary/the-londoner-downsized-toms-weighty-volume-a4233166.html …",leave
148,09,Tom Watson,"Two years ago I turned 50, weighed 22 stone and had type 2 diabetes. By radically changing my nutrition, cutting out sugar, and taking up exercise, I’ve changed my life and reversed my diabetes. I hope my story will inspire others to regain their health and happiness.
@Kyle_Books pic.twitter.com/W43PUUUh6Y",leave
149,09,Tom Watson,"Given Cummings' focus on data science in the Vote Leave campaign the sudden urgent need for big data collection is extremely concerning. We need immediate clarity about how citizens' data will be protected and won’t be misused for party political purposes.
 https://www.buzzfeed.com/alexspence/boris-johnson-dominic-cummings-voter-data …",irrelevant
150,09,Tom Watson,"The book will, don’t worry.",no sentiment
151,09,Tom Watson,Dominic Cummings and the disclosure of emails. It’s been a long time but there’s nothing original any more: https://www.theyworkforyou.com/debates/?id=2012-02-02a.1014.0&s=to+Watson+mail+cummings+speaker%3A11309#g1018.0 …,irrelevant
152,09,Tom Watson,Soon to be farewell to a quite remarkable figure in British politics. He is unique. https://twitter.com/FloraEGill/status/1171088684520738817 …,leave
153,09,Tom Watson,"This is utterly humiliating. Reasoned and statesmanlike from the Irish Taoiseach Leo Varadkar. Johnson, on the other hand, shrinking literally and figuratively in the face of a few home truths.  https://video.twimg.com/amplify_video/1170982933231857665/vid/640x360/DfHqNrf7Jihra45J.mp4?tag=13 …",irrelevant
154,09,Tom Watson,"Nihlism, pure and simple. Let me at least thank you for your service to this party and to your lifelong commitment to make the world a better place.",stay
155,09,Tom Watson,"He promised the people who worked to catch the fish a lot of money. Then he left the market with nothing to show for it, assuming there was no cost to his actions. Presumably, as ever, someone else paid. https://twitter.com/labourwhips/status/1170218099804659712 …",leave
156,09,Tom Watson,Very much ditto. 👏🏻,stay
157,09,Tom Watson,Hire their social media team. https://twitter.com/KFC_UKI/status/1169151825725087744 …,irrelevant
158,09,Tom Watson,It’s like this particular cohort of Bullingdon Club and Old Etonians hit their emotional plateau before graduation from Oxford. Johnson and Rees Mogg in particular see politics as a game. https://twitter.com/SkyNewsBreak/status/1170005038909067264 …,irrelevant
159,09,Tom Watson,"1 in 8 women develop breast cancer in the UK; almost 1,000 die from the disease every month. That's why I'm helping @breastcancernow for #wearitpink. We need to do much more to fund vital research and care. To raise money and support please sign up here  http://wearitpink.org/mp  pic.twitter.com/JRyMoIFTj5",leave
160,09,Tom Watson,Well done Andy. https://twitter.com/patkarney/status/1169926114086719489 …,irrelevant
161,09,Tom Watson,"When average student debt in England is over £50k, the last thing students need is their own admissions body @ucas_online promoting sky-high loans. @MartinSLewis is right - UCAS should stop defending the indefensible and drop these adverts straight away. https://www.moneysavingexpert.com/news/2019/09/beware-student-finance-emails/ …",leave
162,09,Tom Watson,I'm sure Quentin Letts - one of Johnson's chief cheerleaders - regrets many of his tweets. This one he may regret more than others. https://twitter.com/thequentinletts/status/1169850394375098368 …,stay
163,09,Tom Watson,Rees-Mogg should come to the House and apologise. Or dare to repeat his remarks out of the chamber and face the legal consequence.,no sentiment
164,09,Tom Watson,"Jacob Rees-Mogg's disgraceful attack on consultant neurologist Dr David Nicholl - comparing him to the disgraced anti-vaxxer Wakefield - is a new low from the hardline Brextremist Government. And let's face it, the bar set has been pretty low this week. https://www.standard.co.uk/news/politics/jacob-reesmogg-slammed-for-comparing-distinguished-proremain-doctor-to-disgraced-antivaxxer-a4230011.html …",leave
165,09,Tom Watson,A third of our children are leaving primary school overweight or obese. Over 4 million of our citizens have type 2 diabetes. We need radical solutions to curb the UK's obesity crisis. https://www.theguardian.com/society/2019/sep/05/tax-on-snacks-would-have-huge-impact-on-obesity-say-experts …,leave
166,09,Tom Watson,"Once again, the people who trust Boris Johnson least are the ones who know him best. https://twitter.com/theobertram/status/1169558331930923008 …",stay
167,09,Tom Watson,I wonder how many Tory MPs are wishing @theresa_may was still Prime Minister this morning? https://twitter.com/theousherwood/status/1169556834522402816 …,leave
168,09,Tom Watson,"Powerful words from parliamentary colleagues in the House today, impressing on Foreign Secretary need to support UN resolutions on Kashmir. https://twitter.com/tom_watson/status/1167792742992404482 …",leave
169,09,Tom Watson,"Thanks @AgeUKSandwell @AgeUKBirmingham for hosting my and @PreetKGillMP's meeting with @PoppyLegion vets to hear their fury over Tory TV licence duplicity. Come the election, Labour will pledge to maintain the free licence for over 75s. 3.7m seniors mustn't be betrayed. pic.twitter.com/QrXJuT1Tvz",leave
170,09,Tom Watson,A serious intervention from a serious politician. https://twitter.com/SamGyimah/status/1168815558437085187 …,leave
171,09,Tom Watson,This no deal planning report was due to be published today. But last night Michael Gove pulled the plug. The government doesn't want MPs to be allowed to debate Brexit - or the people to know the truth. It's not unreasonable to ask why. https://www.dailymail.co.uk/news/article-7421045/No-Deal-Brexit-lead-months-chaos-public-disorder.html …,leave
172,09,Tom Watson,"What was that @BorisJohnson statement all about? His press people had spun that he’d threaten to call an election. Has he changed his mind?More hot air, again.",no sentiment
173,09,Tom Watson,"The Johnson-Cummings axis is fast-forwarding Robespierre's French Revolution: purges of rivals and allies, revolutionary govt as necessary evil to fight the enemy, and return of constitutional govt only after that enemy is defeated. It won't end well. http://www.tom-watson.com/fear_and_loathing_in_downing_street …",leave
174,09,Tom Watson,The Chancellor's spending review is an opportunity for this Govt to honour its manifesto pledge by funding free TV licences for the over 75s. Failure to do so will ensure every pensioner in Britain will know a Tory Party promise cannot be trusted. https://www.mirror.co.uk/news/politics/labours-tom-watson-urges-chancellor-19123145 …,leave
175,09,Tom Watson,This MP has political courage. They threaten him with ruination and he stands strong. https://twitter.com/DavidGauke/status/1168402448693825536 …,leave
176,09,Tom Watson,"This call for a review of the policy on statins is very significant. @normanlamb is a highly regarded chair of the science committee and former health minister. I’m amazed there isn’t more coverage of the call, given millions of people take statins daily. https://inews.co.uk/news/health/statins-review-nhs-government-chief-medical-adviser-norman-lamb/ …",stay
177,09,Tom Watson,I think he was just returning it?,stay
178,09,Tom Watson,A powerful government representative refusing to confirm they’ll obey the legislative will of Parliament. Think about that for a moment. This is the UK. The correct answer is “we will always obey the will of Parliament” https://twitter.com/BBCPolitics/status/1168083554447659008 …,leave
179,08,Tom Watson,"As millions face a humanitarian crisis, I have sent a message of solidarity from Labour to the people of Kashmir. We call on the UK govt to ensure UN resolutions are fully implemented. The people of Kashmir deserve no less. pic.twitter.com/IG6EUsTN2E",leave
180,08,Tom Watson,This is a personal tragedy for a young woman - victim of the culture of paranoia that now rules No 10. I suspect the fear and paranoia to escalate in the days ahead as those responsible for the attack on our democracy retreat further into their bunker. https://www.theguardian.com/politics/2019/aug/30/sajid-javid-confronts-boris-johnson-over-advisers-sacking …,leave
181,08,Tom Watson,"If you make cars, mend cars or sell cars you honestly deserve better than this. https://twitter.com/SteveBarclay/status/1166765868891725825 …",leave
182,08,Tom Watson,"When our PM is responsible for undermining our democracy, we have to work together to stop him. I’m glad to be working with Jo Swinson and Sir John Major as part of @thatginamiller’s Judicial Review. https://twitter.com/joswinson/status/1167427093346639874 …",leave
183,08,Tom Watson,"YouTube's ""banned today-reinstated tomorrow"" policy for white supremacy preachers would be farcical if not so disturbing. Despite its ""commitment to openness"", we are told nothing of how its hate speech policy has NOT been breached. This is not acceptable. https://www.bbc.co.uk/news/technology-49523239 …",leave
184,08,Tom Watson,"Proroguing Parliament is an unprecedented affront to democracy. The rights and freedoms of our citizens have been vandalised. I will be joining the Judicial Review launched in the High Court by Gina Miller and supported by John Major.

My full statement... pic.twitter.com/lRryvUK1P2",leave
185,08,Tom Watson,Losing free TV licences will leave millions of our oldest citizens more isolated than ever before. The blame lies squarely with the Tories for betraying their manifesto pledge. They should now listen to campaigners. https://www.mirror.co.uk/news/politics/age-uk-piles-fresh-pressure-19033250 …,leave
186,08,Tom Watson,I wonder why @TeamSaj have deleted this tweet... pic.twitter.com/gBqUQo75Rm,stay
187,08,Tom Watson,"Cattle fat on hormones, chickens sterilised in chlorine. The vision of future trade with Trump. It's wrong to promote cheap meat produced through low welfare standards, and right to say it's a political and ethical choice. It's our choice, and we say NO. https://news.sky.com/story/no-health-problems-with-chlorinated-chicken-govts-chief-scientific-adviser-11796443 …",leave
188,08,Tom Watson,In this period of division I still have hope. Thanks for the good times @liamgallagher and @NoelGallagher. https://twitter.com/RoughTrade/status/1166985243741564928 …,irrelevant
189,08,Tom Watson,He won the internal election so I guess this ‘One Nation’ commitment no longer matters to him. pic.twitter.com/A724dCCcmG,stay
190,08,Tom Watson,Also @NickyMorgan01: I’ll join your legal action. https://twitter.com/itvnews/status/1149033941703303169 …,stay
191,08,Tom Watson,"Good morning @NickyMorgan01. It’s reported you said: 
“You cannot say you are going to take back control … and then go: ‘Oh, by the way, we are just going to shut parliament down for a couple of months, so we are just going to drift out on a no deal” Is the quote accurate?",leave
192,08,Tom Watson,And I’m sure @AmberRuddHR will also speak out on Johnson’s anti-democratic decision to prorogue Parliament in order to hold up legitimate discussion in the Commons. https://twitter.com/RidgeOnSunday/status/1140184758720311296 …,leave
193,08,Tom Watson,I’m assuming @MattHancock is considering his position this morning. “to prorogue Parliament would mean the end of the Conservative Party as a serious party of government.” https://twitter.com/MattHancock/status/1136610833750994951 …,leave
194,08,Tom Watson,We do not have a “new government.” This action is an utterly scandalous affront to our democracy. We cannot let this happen. https://www.bbc.com/news/uk-politics-49493632 …,leave
195,08,Tom Watson,"The deeply worrying plight of Bury FC and Bolton Wanderers shows football governance needs to change. Labour will give supporters the opportunity of a greater say in how clubs are run, and it’s clear that ownership regulations need a complete overhaul. https://www.theguardian.com/football/2019/aug/27/bury-and-bolton-two-of-englands-oldest-clubs-face-tuesday-expulsion?fbclid=IwAR0ON8dsf4JMwNI-HZqaui1q5_cq4VekIgzmUCvtMQElcQd-0llFdbxjA7E …",irrelevant
196,08,Tom Watson,"Boris Johnson's disregard of older people is appalling. His government should stop passing the buck, honour the Tory manifesto pledge, and step in to fund the free TV licence for over 75s today. http://www.mirror.co.uk/news/politics/boris-johnson-tries-pass-responsibility-19005212?fbclid=IwAR1522k7ffYLkRZPwgtWvklm5lIHR5lDBbwVqkM_C0F4s60Sact4rOAa1Kg#ICID=Android_TMNewsApp_AppShare …",leave
197,08,Tom Watson,"We must channel the condemnation and rage against Bolsonaro's ecological carnage, and the loss of carbon-capturing rainforest, to develop a massive tree-planting programme to urgently build a sustainable, carbon neutral future for our lands too. http://www.tom-watson.com/the_burning_crisis_of_the_climate_emergency …",irrelevant
198,08,Tom Watson,#Ashes #Stokes #Leach pic.twitter.com/pJ33bN9OPc,irrelevant
199,08,Tom Watson,#ashes pic.twitter.com/iyjgHnote1,irrelevant
200,08,Tom Watson,Given the scale of the briefing operation that amplified this misleading story this is a very measured response. https://twitter.com/PhilipHammondUK/status/1165539601680916480 …,leave
201,08,Tom Watson,"More than 900k veterans are set to lose their free TV licences - 101k will be over 90. Many put their lives on the line for our country, and yet this government hasn't the decency to keep the manifesto promise it made to them. It is a national disgrace. https://www.mirror.co.uk/news/politics/veterans-set-clobbered-tv-licences-18984134 …",leave
202,08,Tom Watson,Boris Johnson has no respect for rules or the truth. No qualms about spending tax payer’s money on his election campaign videos. This needs calling out. https://www.independent.co.uk/news/uk/politics/boris-johnson-propaganda-video-conservatives-public-money-a9062871.html …,irrelevant
203,08,Tom Watson,I’ve asked five friends who aren’t political if they knew the name of the knew UKIP leader. Three got it right. One didn’t know. One thought he was called Mr Head. https://twitter.com/TheNewEuropean/status/1161654965200400384 …,leave
204,08,Tom Watson,"And more importantly, thanks for the boomerang lesson.",stay
205,08,Tom Watson,Lovely to meet you all Katie. Don’t forget to send me everyone’s Twitter details.,no sentiment
206,08,Tom Watson,Really pleased to see the Birmingham Commonwealth Games 2022 will host highest-ever number of Commonwealth para-sports events - and be the first major multi-sports events to have more women's than men's medal events. #Birmingham22 making a big statement. https://www.bbc.co.uk/sport/commonwealth-games/49322435 …,irrelevant
207,08,Tom Watson,Thanks for getting in touch. I’d love to come and see your work some time.,stay
208,08,Tom Watson,"Fascinating interview, as ever. Thanks so much for your work.",stay
209,08,Tom Watson,"I’m perfectly serious about the role for tree planting, which is vital for addressing climate change. Climate extinction will be more easily averted with greater collaboration across the EU of course. I think you know this.",leave
210,08,Tom Watson,Its certainly a policy space that could be improved with greater collaboration.,stay
211,08,Tom Watson,"I absolutely love the work of the @WoodlandTrust. Arboreal ambition should be a feature of the next general election, for all parties. https://twitter.com/JVCooper100/status/1160929224783515648 …",stay
